title,type,director,cast,country,date_added,release_year,rating,duration,listed_in,title_length,genres_count,score
Blood & Water,TV Show,,"Ama Qamata, Khosi Ngema, Gail Mabalane, Thabang Molaba, Dillon Windvogel, Natasha Thahane, Arno Greeff, Xolile Tshabalala, Getmore Sithole, Cindy Mahlangu, Ryle De Morny, Greteli Fincham, Sello Maake Ka-Ncube, Odwa Gwanya, Mekaila Mathys, Sandi Schultz, Duane Williams, Shamilla Miller, Patrick Mofokeng",South Africa,"September 24, 2021",2021,TV-MA,2 Seasons,"International TV Shows, TV Dramas, TV Mysteries",11,3,0.7857142857142857
Ganglands,TV Show,Julien Leclercq,"Sami Bouajila, Tracy Gotoas, Samuel Jouy, Nabiha Akkari, Sofia Lesaffre, Salim Kechiouche, Noureddine Farihi, Geert Van Rampelberg, Bakary Diombera",,"September 24, 2021",2021,TV-MA,1 Season,"Crime TV Shows, International TV Shows, TV Action & Adventure",9,3,0.75
Jailbirds New Orleans,TV Show,,,,"September 24, 2021",2021,TV-MA,1 Season,"Docuseries, Reality TV",19,2,0.9047619047619048
Kota Factory,TV Show,,"Mayur More, Jitendra Kumar, Ranjan Raj, Alam Khan, Ahsaas Channa, Revathi Pillai, Urvi Singh, Arun Kumar",India,"September 24, 2021",2021,TV-MA,2 Seasons,"International TV Shows, Romantic TV Shows, TV Comedies",11,3,0.7857142857142857
Midnight Mass,TV Show,Mike Flanagan,"Kate Siegel, Zach Gilford, Hamish Linklater, Henry Thomas, Kristin Lehman, Samantha Sloyan, Igby Rigney, Rahul Kohli, Annarah Cymone, Annabeth Gish, Alex Essoe, Rahul Abburi, Matt Biedel, Michael Trucco, Crystal Balint, Louis Oliver",,"September 24, 2021",2021,TV-MA,1 Season,"TV Dramas, TV Horror, TV Mysteries",12,3,0.8
The Great British Baking Show,TV Show,Andy Devonshire,"Mel Giedroyc, Sue Perkins, Mary Berry, Paul Hollywood",United Kingdom,"September 24, 2021",2021,TV-14,9 Seasons,"British TV Shows, Reality TV",25,2,0.9259259259259259
"Vendetta: Truth, Lies and The Mafia",TV Show,,,,"September 24, 2021",2021,TV-MA,1 Season,"Crime TV Shows, Docuseries, International TV Shows",30,3,0.9090909090909091
Bangkok Breaking,TV Show,Kongkiat Komesiri,"Sukollawat Kanarot, Sushar Manaying, Pavarit Mongkolpisit, Sahajak Boonthanakit, Suthipongse Thatphithakkul, Bhasaworn Bawronkirati, Daweerit Chullasapya, Waratthaya Wongchayaporn, Kittiphoom Wongpentak, Abhicha Thanachanun, Nophand Boonyai, Kittipong Khamsat, Arisara Wongchalee, Jaytiya Naiwattanakul, Pantipa Arunwattanachai, Panupan Jantanawong, Kungtap Saelim, Phumphat Chartsuriyakiat, Issara Veranitinunt, Keerati Sivakuae, Panjai Sirisuwan, Supranee Charoenpol, Suda Chuenban, Visaka Banhansupavat, Pitchatorn Santinatornkul",,"September 23, 2021",2021,TV-MA,1 Season,"Crime TV Shows, International TV Shows, TV Action & Adventure",15,3,0.8333333333333334
Crime Stories: India Detectives,TV Show,,,,"September 22, 2021",2021,TV-MA,1 Season,"British TV Shows, Crime TV Shows, Docuseries",28,3,0.9032258064516129
Dear White People,TV Show,,"Logan Browning, Brandon P. Bell, DeRon Horton, Antoinette Robertson, John Patrick Amedori, Ashley Blaine Featherson, Marque Richardson, Giancarlo Esposito",United States,"September 22, 2021",2021,TV-MA,4 Seasons,"TV Comedies, TV Dramas",15,2,0.8823529411764706
Falsa identidad,TV Show,,"Luis Ernesto Franco, Camila Sodi, Sergio Goyri, Samadhi Zendejas, Eduardo Yáñez, Sonya Smith, Alejandro Camacho, Azela Robinson, Uriel del Toro, Géraldine Bazán, Gabriela Roel, Marcus Ornellas",Mexico,"September 22, 2021",2020,TV-MA,2 Seasons,"Crime TV Shows, Spanish-Language TV Shows, TV Dramas",14,3,0.8235294117647058
Jaguar,TV Show,,"Blanca Suárez, Iván Marcos, Óscar Casas, Adrián Lastra, Francesc Garrido, Stefan Weinert, Julia Möller, Alicia Chojnowski",,"September 22, 2021",2021,TV-MA,1 Season,"International TV Shows, Spanish-Language TV Shows, TV Action & Adventure",6,3,0.6666666666666666
Monsters Inside: The 24 Faces of Billy Milligan,TV Show,Olivier Megaton,,,"September 22, 2021",2021,TV-14,1 Season,"Crime TV Shows, Docuseries, International TV Shows",40,3,0.9302325581395349
Resurrection: Ertugrul,TV Show,,"Engin Altan Düzyatan, Serdar Gökhan, Hülya Darcan, Kaan Taşaner, Esra Bilgiç, Osman Soykut, Serdar Deniz, Cengiz Coşkun, Reshad Strik, Hande Subaşı",Turkey,"September 22, 2021",2018,TV-14,5 Seasons,"International TV Shows, TV Action & Adventure, TV Dramas",21,3,0.875
Love on the Spectrum,TV Show,,Brooke Satchwell,Australia,"September 21, 2021",2021,TV-14,2 Seasons,"Docuseries, International TV Shows, Reality TV",17,3,0.85
Chicago Party Aunt,TV Show,,"Lauren Ash, Rory O'Malley, RuPaul Charles, Jill Talley, Ike Barinholtz, Jon Barinholtz, Matthew Craig, Bob Odenkirk, Mike Hagerty, Katie Rich, Chris Witaske",,"September 17, 2021",2021,TV-MA,1 Season,TV Comedies,16,1,0.9411764705882353
Sex Education,TV Show,,"Asa Butterfield, Gillian Anderson, Ncuti Gatwa, Emma Mackey, Connor Swindells, Kedar Williams-Stirling, Alistair Petrie",United Kingdom,"September 17, 2021",2020,TV-MA,3 Seasons,"British TV Shows, International TV Shows, TV Comedies",12,3,0.8
Squid Game,TV Show,,"Lee Jung-jae, Park Hae-soo, Wi Ha-jun, Oh Young-soo, Jung Ho-yeon, Heo Sung-tae, Kim Joo-ryoung, Tripathi Anupam, You Seong-joo, Lee You-mi",,"September 17, 2021",2021,TV-MA,1 Season,"International TV Shows, TV Dramas, TV Thrillers",9,3,0.75
Tayo and Little Wizards,TV Show,,"Dami Lee, Jason Lee, Bommie Catherine Han, Jennifer Waescher, Nancy Kim",,"September 17, 2021",2020,TV-Y7,1 Season,Kids' TV,20,1,0.9523809523809523
Angry Birds,TV Show,,"Antti Pääkkönen, Heljä Heikkinen, Lynne Guaglione, Pasi Ruohonen, Rauno Ahonen",Finland,"September 16, 2021",2018,TV-Y7,1 Season,"Kids' TV, TV Comedies",10,2,0.8333333333333334
Chhota Bheem,TV Show,,"Vatsal Dubey, Julie Tejwani, Rupa Bhimani, Jigna Bhardwaj, Rajesh Kava, Mousam, Swapnil",India,"September 16, 2021",2021,TV-Y7,3 Seasons,Kids' TV,11,1,0.9166666666666666
He-Man and the Masters of the Universe,TV Show,,"Yuri Lowenthal, Kimberly Brooks, Antony Del Rio, Trevor Devall, Ben Diskin, Grey Griffin, David Kaye, Tom Kenny, Judy Alice Lee, Roger Craig Smith, Fred Tatasciore",United States,"September 16, 2021",2021,TV-Y7,1 Season,"Kids' TV, TV Sci-Fi & Fantasy",32,2,0.9411764705882353
The Smart Money Woman,TV Show,Bunmi Ajakaiye,"Osas Ighodaro, Ini Dima-Okojie, Kemi Lala Akindoju, Toni Tones, Ebenezer Eno, Eso Okolocha DIke, Patrick Diabuah, Karibi Fubara, Temisan Emmanuel, Timini Egbuson",,"September 16, 2021",2020,TV-MA,1 Season,"International TV Shows, Romantic TV Shows, TV Comedies",18,3,0.8571428571428571
Castle and Castle,TV Show,,"Richard Mofe-Damijo, Dakore Akande, Bimbo Manuel, Blossom Chukwujekwu, Deyemi Okanlawon, Etim Effiong, Denola Grey, Duke Akintola, Eku Edewor, Ade Laoye, Anee Icha, Kevin Ushi, Jude Chukwuka, Amanda Afolabi",Nigeria,"September 15, 2021",2021,TV-MA,2 Seasons,"International TV Shows, TV Dramas",15,2,0.8823529411764706
Dharmakshetra,TV Show,,"Kashmira Irani, Chandan Anand, Dinesh Mehta, Ankit Arora, Pushkar Goggiaa, Anjali Rana, Aarya DharmChand Kumar, Amit Behl, Maleeka Ghai",India,"September 15, 2021",2014,TV-PG,1 Season,"International TV Shows, TV Dramas, TV Sci-Fi & Fantasy",13,3,0.8125
Nailed It,TV Show,,"Nicole Byer, Jacques Torres",United States,"September 15, 2021",2021,TV-PG,6 Seasons,Reality TV,8,1,0.8888888888888888
Numberblocks,TV Show,,"Beth Chalmers, David Holt, Marcel McCalla, Teresa Gallagher",United Kingdom,"September 15, 2021",2021,TV-Y,6 Seasons,Kids' TV,12,1,0.9230769230769231
Raja Rasoi Aur Anya Kahaniyan,TV Show,,,India,"September 15, 2021",2014,TV-G,1 Season,"Docuseries, International TV Shows",25,2,0.9259259259259259
Saved by the Bell,TV Show,,"Mark-Paul Gosselaar, Tiffani Thiessen, Mario Lopez, Lark Voorhies, Elizabeth Berkley, Dustin Diamond, Dennis Haskins",United States,"September 15, 2021",1994,TV-PG,9 Seasons,"Kids' TV, TV Comedies",14,2,0.875
Stories by Rabindranath Tagore,TV Show,,,India,"September 15, 2021",2015,TV-PG,1 Season,"International TV Shows, TV Dramas",27,2,0.9310344827586207
Too Hot To Handle: Latino,TV Show,,Itatí Cantoral,,"September 15, 2021",2021,TV-MA,1 Season,"International TV Shows, Reality TV, Romantic TV Shows",21,3,0.875
Jack Whitehall: Travels with My Father,TV Show,,"Jack Whitehall, Michael Whitehall",United Kingdom,"September 14, 2021",2021,TV-MA,5 Seasons,"British TV Shows, Docuseries, International TV Shows",33,3,0.9166666666666666
The World's Most Amazing Vacation Rentals,TV Show,,,,"September 14, 2021",2021,TV-PG,2 Seasons,Reality TV,36,1,0.972972972972973
Yowamushi Pedal,TV Show,,"Daiki Yamashita, Kohsuke Toriumi, Jun Fukushima, Hiroki Yasumoto, Showtaro Morikubo, Kentaro Ito, Daisuke Kishio, Yoshitsugu Matsuoka, Junichi Suwabe, Ayaka Suwa, Megumi Han, Tomoaki Maeno, Tsubasa Yonaga, Tetsuya Kakihara, Satoshi Hino, Hiroyuki Yoshino, Atsushi Abe, Koji Yusa, Kouki Miyata, Hiro Shimono, Wataru Hatano, Yuichi Nakamura, Kenji Nojima, Mamoru Miyano, Daisuke Ono, Yuma Uchida, Jun Fukuyama",Japan,"September 14, 2021",2013,TV-14,1 Season,"Anime Series, International TV Shows",14,2,0.875
Lucifer,TV Show,,"Tom Ellis, Lauren German, Kevin Alejandro, D.B. Woodside, Lesley-Ann Brandt, Scarlett Estevez, Rachael Harris, Aimee Garcia, Tricia Helfer, Tom Welling, Jeremiah W. Birkett, Pej Vahdat, Michael Gladis",United States,"September 10, 2021",2021,TV-14,6 Seasons,"Crime TV Shows, TV Comedies, TV Dramas",7,3,0.7
Metal Shop Masters,TV Show,,Jo Koy,,"September 10, 2021",2021,TV-MA,1 Season,Reality TV,16,1,0.9411764705882353
Pokémon Master Journeys: The Series,TV Show,,"Ikue Otani, Sarah Natochenny, Zeno Robinson, Cherami Leigh, James Carter Cathcart, Michele Knotz, Rodger Parsons, Ray Chase, Casey Mongillo, Tara Sands",,"September 10, 2021",2021,TV-Y7,1 Season,"Anime Series, Kids' TV",31,2,0.9393939393939394
Titipo Titipo,TV Show,,"Jeon Hae-ri, Kim Eun-ah, Hong Bum-ki, Nam Do-hyeong, Um Sang-hyun",,"September 10, 2021",2019,TV-Y,2 Seasons,"Kids' TV, Korean TV Shows",12,2,0.8571428571428571
Mighty Raju,TV Show,,"Julie Tejwani, Sabina Malik, Jigna Bhardwaj, Rupa Bhimani, Lalit Agarwal, Rajesh Shukla, Rajesh Kava",,"September 9, 2021",2017,TV-Y7,4 Seasons,Kids' TV,10,1,0.9090909090909091
Into the Night,TV Show,,"Pauline Etienne, Laurent Capelluto, Stefano Cassetti, Mehmet Kurtuluş, Babetida Sadjo, Jan Bijvoet, Ksawery Szlenkier, Vincent Londez, Regina Bikkinina, Alba Gaïa Kraghede Bellugi, Nabil Mallat",Belgium,"September 8, 2021",2021,TV-MA,2 Seasons,"International TV Shows, TV Dramas, TV Mysteries",12,3,0.8
The Circle,TV Show,,Michelle Buteau,"United States, United Kingdom","September 8, 2021",2021,TV-MA,3 Seasons,Reality TV,9,1,0.9
Kid Cosmic,TV Show,,"Jack Fisher, Tom Kenny, Amanda C. Miller, Kim Yarbrough, Keith Ferguson, Grey Griffin, Lily Rose Silver",United States,"September 7, 2021",2021,TV-Y7,2 Seasons,"Kids' TV, TV Comedies, TV Sci-Fi & Fantasy",9,3,0.75
Octonauts: Above & Beyond,TV Show,,"Antonio Aakeel, Chipo Chung, Simon Foster, Teresa Gallagher, Simon Greenall, Kate Harbour, Paul Panting, Rob Rackstraw, William Vanderpuye, Helen Walsh, Keith Wickham, Andres Williams, Jo Wyatt",United Kingdom,"September 7, 2021",2021,TV-Y,1 Season,"British TV Shows, Kids' TV",22,2,0.9166666666666666
On the Verge,TV Show,,"Julie Delpy, Elisabeth Shue, Sarah Jones, Alexia Landeau, Mathieu Demy, Troy Garity, Timm Sharp, Giovanni Ribisi","France, United States","September 7, 2021",2021,TV-MA,1 Season,"TV Comedies, TV Dramas",10,2,0.8333333333333334
Tobot Galaxy Detectives,TV Show,,"Austin Abell, Travis Turner, Cole Howard, Anna Cummer, Jesse Inocalla, Brian Dobson, Michael Adamthwaite, Joseph Girgis, Caitlyn Bairstow",,"September 7, 2021",2019,TV-Y7,2 Seasons,Kids' TV,21,1,0.9545454545454546
Countdown: Inspiration4 Mission to Space,TV Show,Jason Hehir,,,"September 6, 2021",2021,TV-14,1 Season,"Docuseries, Science & Nature TV",36,2,0.9473684210526315
Tayo the Little Bus,TV Show,,"Robyn Slade, Kami Desilets",South Korea,"September 6, 2021",2016,TV-Y,2 Seasons,"Kids' TV, Korean TV Shows",16,2,0.8888888888888888
Bunk'd,TV Show,,"Peyton List, Karan Brar, Skai Jackson, Miranda May, Kevin G. Quinn, Nathan Arenas, Nina Lu",United States,"September 5, 2021",2021,TV-G,5 Seasons,"Kids' TV, TV Comedies",6,2,0.75
Dive Club,TV Show,,"Aubri Ibrag, Sana'a Shaik, Miah Madden, Mercy Cornwall, Georgia-May Davis, Ryan Harrison, Josh Heuston, Alexander Grant",Australia,"September 3, 2021",2021,TV-G,1 Season,"Kids' TV, TV Dramas, Teen TV Shows",8,3,0.7272727272727273
La casa de papel,TV Show,,"Úrsula Corberó, Itziar Ituño, Álvaro Morte, Paco Tous, Enrique Arce, Pedro Alonso, María Pedraza, Alba Flores, Miguel Herrán, Jaime Lorente, Esther Acebo, Darko Peric, Kiti Mánver",Spain,"September 3, 2021",2021,TV-MA,5 Seasons,"Crime TV Shows, International TV Shows, Spanish-Language TV Shows",13,3,0.8125
Money Heist: From Tokyo to Berlin,TV Show,"Luis Alfaro, Javier Gómez Santander",,,"September 3, 2021",2021,TV-MA,1 Season,"Docuseries, International TV Shows, Spanish-Language TV Shows",28,3,0.9032258064516129
Sharkdog,TV Show,,"Liam Mitchell, Dee Bradley Baker, Grey Griffin, Josh McDermitt, Kari Wahlgren, Judy Alice Lee, Ali Mawji","United States, Singapore","September 3, 2021",2021,TV-Y,1 Season,Kids' TV,8,1,0.8888888888888888
Heroes of Goo Jit Zu,TV Show,,"Jon Allen, Kellen Goff, Joe Hernandez, Kaiji Tang",Australia,"September 2, 2021",2021,TV-Y7,1 Season,"Kids' TV, TV Comedies",16,2,0.8888888888888888
Hotel Del Luna,TV Show,,"Lee Ji-eun, Yeo Jin-goo, Shin Jung-geun, Seo Yi-sook, Bae Hae-sun, Pyo Ji-hoon, Cho Hyun-chul, Kang Hong-suk, Lee Do-hyun, Lee Tae-seon, Kang Mina, Park You-na, Oh Ji-ho",,"September 2, 2021",2019,TV-14,1 Season,"International TV Shows, Romantic TV Shows, TV Comedies",12,3,0.8
Luv Kushh,TV Show,,,,"September 2, 2021",2012,TV-Y7,1 Season,Kids' TV,8,1,0.8888888888888888
Pororo - The Little Penguin,TV Show,,,South Korea,"September 2, 2021",2013,TV-Y7,3 Seasons,"Kids' TV, Korean TV Shows",23,2,0.92
Q-Force,TV Show,,"Sean Hayes, Wanda Sykes, Laurie Metcalf, David Harbour, Gary Cole, Patti Harrison, Matt Rogers",United States,"September 2, 2021",2021,TV-MA,1 Season,"Crime TV Shows, TV Action & Adventure, TV Comedies",7,3,0.7
Brave Animated Series,TV Show,,"Tseng Yun-fan, Kao Yun-shuo, Chiang Ching-yen, Meng Ching-fu, Huang Bai-wei, Ma Kuo-yao, Chen Yen-chun, Sun Ke-fang, Kai Yang-niu, Chen Yu-wen, Nick Liao, Lin Kai-ling, Mickey Huang, Liu Kuan-ting, Jiang Du-hui",,"September 1, 2021",2021,TV-MA,1 Season,"International TV Shows, TV Action & Adventure, TV Comedies",19,3,0.8636363636363636
How to Be a Cowboy,TV Show,,,,"September 1, 2021",2021,TV-PG,1 Season,Reality TV,14,1,0.9333333333333333
HQ Barbers,TV Show,Gerhard Mostert,"Hakeem Kae-Kazim, Chioma Omeruah, Orukotan Adejola, Flora Chiedo, Emeka Nwagbaraocha, Anthony Oseyemi, Oluwabukola Thomas, Soibifaa Dokubo",,"September 1, 2021",2020,TV-14,1 Season,TV Shows,9,1,0.9
Kid-E-Cats,TV Show,,"Lori Gardner, Kate Bristol, Billy Bob Thompson, Marc Thompson, Erica Schroeder",Russia,"September 1, 2021",2016,TV-Y,2 Seasons,Kids' TV,10,1,0.9090909090909091
Kuroko's Basketball,TV Show,,"Kensho Ono, Yuki Ono, Chiwa Saito, Yoshimasa Hosoya, Hirofumi Nojima, Kenji Hamada, Takuya Eguchi, Soichiro Hoshi, Tatsuhisa Suzuki, Go Inoue, Daisuke Ono, Ryohei Kimura, Junichi Suwabe, Kazuya Nakai, Fumiko Orikasa, Kenichi Suzumura, Kisho Taniyama, Hiroshi Kamiya",Japan,"September 1, 2021",2015,TV-MA,3 Seasons,"Anime Series, International TV Shows, Teen TV Shows",18,3,0.8571428571428571
Major Dad,TV Show,,"Gerald McRaney, Shanna Reed, Nicole Dubuc, Chelsea Hertford, Marisa Ryan, Matt Mulhern, Beverly Archer, Jon Cypher",United States,"September 1, 2021",1992,TV-PG,4 Seasons,TV Comedies,8,1,0.8888888888888888
Oldsters,TV Show,,"Patricio Contreras, Alejandro Goic, Sergio Hernández, Mariana Loyola Ruz, Alejandro Trejo, Daniel Alcaíno Cuevas, Nicolás Poblete, Susana Hidalgo, Gloria Münchmeyer",,"September 1, 2021",2019,TV-MA,1 Season,"Crime TV Shows, International TV Shows, Spanish-Language TV Shows",8,3,0.7272727272727273
Turning Point: 9/11 and the War on Terror,TV Show,,,,"September 1, 2021",2021,TV-14,1 Season,Docuseries,34,1,0.9714285714285714
Sparking Joy,TV Show,,Marie Kondo,United States,"August 31, 2021",2021,TV-PG,1 Season,Reality TV,11,1,0.9166666666666666
Hometown Cha-Cha-Cha,TV Show,,"Shin Min-a, Kim Seon-ho, Lee Sang-yi, Gong Min-jeung, Kim Young-ok, Cho Han-cheul, In Gyo-jin, Lee Bong-ryeon, Cha Cheong-hwa, Kang Hyung-suk",,"August 29, 2021",2021,TV-14,1 Season,"International TV Shows, Romantic TV Shows, TV Comedies",19,3,0.8636363636363636
The Ingenuity of the Househusband,TV Show,,Kenjiro Tsuda,,"August 29, 2021",2021,TV-G,1 Season,"International TV Shows, TV Comedies",29,2,0.9354838709677419
Bread Barbershop,TV Show,,"Um Sang-hyun, Park Yoon-hee, Kang Shi-hyun, Hong Bum-ki, Kim Hyun-wook, Lee In-suk, Song Ha-rim",,"August 28, 2021",2020,TV-Y,2 Seasons,"Kids' TV, TV Comedies",15,2,0.8823529411764706
D.P.,TV Show,,"Jung Hae-in, Koo Kyo-hwan, Kim Sung-kyun, Son Suk-ku",", South Korea","August 27, 2021",2021,TV-MA,1 Season,"International TV Shows, TV Dramas",4,2,0.6666666666666666
Deadly Sins,TV Show,,"Frank Ramirez, Patricia Castañeda, Chela del Río, Patrick Delmas, María José Martínez, Robinson Díaz, Juan Ángel, Guillermo Olarte, Constanza Duque, Marcela Carvajal",,"August 27, 2021",2002,TV-MA,1 Season,"International TV Shows, Spanish-Language TV Shows, TV Dramas",10,3,0.7692307692307693
I Heart Arlo,TV Show,,"Michael J. Woodard, Mary Lambert, Jonathan Van Ness, Haley Tju, Brett Gelman, Tony Hale, Vincent Rodriguez III, Annie Potts, Jessica Williams, Melissa Villaseñor, Cathy Vu, Jennifer Coolidge, Flea",,"August 27, 2021",2021,TV-Y7,1 Season,"Kids' TV, TV Comedies",10,2,0.8333333333333334
King of Boys: The Return of the King,TV Show,Kemi Adetiba,"Sola Sobowale, Toni Tones, Richard Mofe-Damijo, Efa Iwara, Titi Kuti, Tobechukwu ""iLLbliss"" Ejiofor, Remilekun ""Reminisce"" Safaru, Charles  ""Charly Boy"" Oputa, Nse Ikpe-Etim, Keppy Ekpenyong Bassey, Bimbo Manuel, Akin Lewis, Lord Frank, Osas Ighodaro, Taiwo Ajai-Lycett, Paul Sambo",Nigeria,"August 27, 2021",2021,TV-MA,1 Season,"Crime TV Shows, International TV Shows, TV Dramas",29,3,0.90625
Rebellion,TV Show,,"Charlie Murphy, Ruth Bradley, Sarah Greene, Brian Gleeson, Michelle Fairley, Ian McElhinney, Michael Ford-FitzGerald, Paul Reid, Barry Ward, Tom Turner, Perdita Weeks, Andrew Simpson, Sophie Robinson",Ireland,"August 27, 2021",2016,TV-MA,2 Seasons,"International TV Shows, TV Dramas",9,2,0.8181818181818182
RIDE ON TIME,TV Show,,"King & Prince, Hey! Say! JUMP, KAT-TUN, NEWS, Kansai Johnny's Jr., Snow Man, Tomoyuki Yara, Travis Japan, Bi shonen, SixTONES, HiHi Jets, Kis-My-Ft2, Koichi Domoto",,"August 27, 2021",2021,TV-PG,3 Seasons,"Docuseries, International TV Shows",10,2,0.8333333333333334
Titletown High,TV Show,,,,"August 27, 2021",2021,TV-14,1 Season,"Reality TV, Teen TV Shows",13,2,0.8666666666666667
EDENS ZERO,TV Show,,"Takuma Terashima, Mikako Komatsu, Rie Kugimiya, Hiromichi Tezuka, Shiori Izawa, Shiki Aoki, Sayaka Ohara, Hochu Otsuka, Kikuko Inoue",Japan,"August 26, 2021",2021,TV-14,1 Season,"Anime Series, International TV Shows",9,2,0.8181818181818182
Family Reunion,TV Show,,"Loretta Devine, Tia Mowry-Hardrict, Anthony Alabi, Talia Jackson, Isaiah Russell-Bailey, Cameron J. Wright, Jordyn Raya James, Richard Roundtree",United States,"August 26, 2021",2021,TV-PG,4 Seasons,"Kids' TV, TV Comedies",13,2,0.8666666666666667
Clickbait,TV Show,Brad Anderson,"Zoe Kazan, Betty Gabriel, Adrian Grenier, Phoenix Raei, Abraham Lim, Jessica Collins, Camaron Engels, Jaylin Fletcher, Liz Alexander, Joyce Guy, Daniel Henshall, Ian Meadows, Jamie Timony, Steve Mouzakis, Becca Lish",,"August 25, 2021",2021,TV-MA,1 Season,"Crime TV Shows, TV Dramas, TV Mysteries",9,3,0.75
John of God: The Crimes of a Spiritual Healer,TV Show,"Mauricio Dias, Tatiana Villela",,,"August 25, 2021",2021,TV-MA,1 Season,"Crime TV Shows, Docuseries, International TV Shows",37,3,0.925
Motel Makeover,TV Show,,,,"August 25, 2021",2021,TV-14,1 Season,"International TV Shows, Reality TV",13,2,0.8666666666666667
Open Your Eyes,TV Show,,"Maria Wawreniuk, Ignacy Liss, Michał Sikorski, Wojciech Dolatowski, Klaudia Koścista, Zuzanna Galewicz, Marta Nieradkiewicz, Sara Celler Jezierska, Pola Król, Marcin Czarnik, Martyna Nowakowska",,"August 25, 2021",2021,TV-MA,1 Season,"International TV Shows, TV Dramas, TV Mysteries",12,3,0.8
Post Mortem: No One Dies in Skarnes,TV Show,,"Kathrine Thorborg Johansen, Elias Holmen Sørensen, André Sørum, Kim Fairchild, Sara Khorami, Terje Strømdahl, Øystein Røger, Marianne Jonger, Martin Karelius",,"August 25, 2021",2021,TV-MA,1 Season,"International TV Shows, TV Comedies, TV Dramas",29,3,0.90625
Wheel of Fortune,TV Show,,"Pat Sajak, Vanna White",United States,"August 25, 2021",2019,TV-G,3 Seasons,Reality TV,14,1,0.9333333333333333
Oggy Oggy,TV Show,,,,"August 24, 2021",2021,TV-Y,1 Season,"Kids' TV, TV Comedies",8,2,0.8
Manifest,TV Show,,"Melissa Roxburgh, Josh Dallas, Athena Karkanis, J.R. Ramirez, Luna Blaise, Jack Messina, Parveen Kaur",United States,"August 21, 2021",2021,TV-14,3 Seasons,"TV Dramas, TV Mysteries, TV Sci-Fi & Fantasy",8,3,0.7272727272727273
Comedy Premium League,TV Show,,,,"August 20, 2021",2021,TV-MA,1 Season,"International TV Shows, TV Comedies",19,2,0.9047619047619048
Everything Will Be Fine,TV Show,,"Lucía Uribe, Flavio Medina, Isabella Vazquez Morales, Pierre Louis, Mercedes Hernández",,"August 20, 2021",2021,TV-MA,1 Season,"International TV Shows, Spanish-Language TV Shows, TV Comedies",20,3,0.8695652173913043
Korean Cold Noodle Rhapsody,TV Show,,Paik Jong-won,,"August 20, 2021",2021,TV-PG,1 Season,"Docuseries, International TV Shows",24,2,0.9230769230769231
The Chair,TV Show,,"Sandra Oh, Jay Duplass, Holland Taylor, David Morse, Bob Balaban, Nana Mensah, Everly Carganilla",,"August 20, 2021",2021,TV-MA,1 Season,"TV Comedies, TV Dramas",8,2,0.8
Go! Go! Cory Carson,TV Show,,"Alan C. Lim, Paul Killam, Maisie Benson, Kerry Gudjohnsen, Smith Foreman, Neena-Sinaii Simpo, Eli Morse, Adelaide Hirasaki, Jim Capobianco, Anna Chambers, Pfifer Chastain",United States,"August 18, 2021",2021,TV-Y,5 Seasons,Kids' TV,16,1,0.9411764705882353
The Defeated,TV Show,,"Taylor Kitsch, Nina Hoss, Logan Marshall-Green, Michael C. Hall, Tuppence Middleton, Mala Emde, Maximilian Ehrenreich, Sebastian Koch, Anne Ratte-Polle, Lena Dörrie, Benjamin Sadler",,"August 18, 2021",2020,TV-MA,1 Season,"Crime TV Shows, International TV Shows, TV Dramas",11,3,0.7857142857142857
Mother Goose Club,TV Show,,,United States,"August 16, 2021",2016,TV-Y,2 Seasons,Kids' TV,15,1,0.9375
Rascal Does Not Dream of Bunny Girl Senpai,TV Show,,"Kaito Ishikawa, Asami Seto, Nao Toyama, Atsumi Tanezaki, Maaya Uchida, Yurika Kubo, Inori Minase",Japan,"August 15, 2021",2018,TV-14,1 Season,"Anime Series, International TV Shows, Romantic TV Shows",35,3,0.9210526315789473
The Creative Indians,TV Show,,,India,"August 15, 2021",2020,TV-MA,1 Season,"Docuseries, International TV Shows",18,2,0.9
Winx Club,TV Show,,"Liza Jacqueline, Helena Evangeliou, Lisa Ortiz, Kerry Williams, Gregory Abbey, Dan Green, Michael Sinterniklaas, Suzy Myers, Christina Rodriguez, Dani Schaffel, Sebastian Arcelus, Rachael Lillis",Italy,"August 15, 2021",2015,TV-Y7,2 Seasons,Kids' TV,8,1,0.8888888888888888
Brand New Cherry Flavor,TV Show,,"Rosa Salazar, Eric Lange, Catherine Keener, Jeff Ward, Manny Jacinto, Hannah Levien, Patrick Fischler",United States,"August 13, 2021",2021,TV-MA,1 Season,"TV Dramas, TV Horror, TV Mysteries",20,3,0.8695652173913043
Fast & Furious Spy Racers,TV Show,,"Tyler Posey, Charlet Chung, Jorge Diaz, Camille Ramsey, Luke Youngblood, Renée Elise Goldsberry",United States,"August 13, 2021",2021,TV-Y7,5 Seasons,Kids' TV,21,1,0.9545454545454546
Gone for Good,TV Show,Juan Carlos Medina,"Finnegan Oldfield, Nicolas Duvauchelle, Guillaume Gouix, Garance Marillier, Nailia Harzoune",France,"August 13, 2021",2021,TV-MA,1 Season,"Crime TV Shows, International TV Shows, TV Dramas",11,3,0.7857142857142857
Grace and Frankie,TV Show,,"Jane Fonda, Lily Tomlin, Martin Sheen, Sam Waterston, June Diane Raphael, Brooklyn Decker, Ethan Embry, Baron Vaughn",United States,"August 13, 2021",2021,TV-MA,7 Seasons,"TV Comedies, TV Dramas",15,2,0.8823529411764706
The Kingdom,TV Show,,"Chino Darín, Nancy Dupláa, Joaquín Furriel, Peter Lanzani, Mercedes Morán, Diego Peretti, Vera Spinetta, Nico García Hume, Victoria Almeida, Santiago Korovsky, Patricio Aramburu, Alfonso Tort, Diego Gentile, Néstor Guzzini, Daniel Kuzniecka",Argentina,"August 13, 2021",2021,TV-MA,1 Season,"Crime TV Shows, International TV Shows, Spanish-Language TV Shows",10,3,0.7692307692307693
Valeria,TV Show,Inma Torrente,"Diana Gómez, Silma López, Paula Malia, Teresa Riott, Maxi Iglesias, Ibrahim Al Shami",Spain,"August 13, 2021",2021,TV-MA,2 Seasons,"International TV Shows, Romantic TV Shows, Spanish-Language TV Shows",7,3,0.7
AlRawabi School for Girls,TV Show,,"Andria Tayeh, Rakeen Sa'ad, Noor Taher, Yara Mustafa, Joanna Arida, Salsabiela, Nadera Emran, Reem Saadeh",Jordan,"August 12, 2021",2021,TV-14,1 Season,"International TV Shows, TV Dramas, Teen TV Shows",22,3,0.88
Bake Squad,TV Show,,,United States,"August 11, 2021",2021,TV-PG,1 Season,Reality TV,9,1,0.9
Gabby's Dollhouse,TV Show,,"Laila Lockhart Kraner, Tucker Chandler, Juliet Donenfeld, Maggi Lowe, Donovan Patton, Eduardo Franco, Tara Strong, Secunda Wood, Carla Tassara, Sainty Nelsen",United States,"August 10, 2021",2021,TV-Y,2 Seasons,Kids' TV,16,1,0.9411764705882353
I Need Romance,TV Show,Sakon Tiacharoen,"Khemanit Jamikorn, Thitipoom Techaapaikhun, Kannaporn Puangthong, Premmanat Suwannanon, Mintita Wattanakul, Thames Sanpakit, Katareeya Theapchatri, Phanuroj Chalermkijporntavee, Jirapisit Jaravijit",,"August 10, 2021",2021,TV-14,1 Season,"International TV Shows, Romantic TV Shows, TV Comedies",12,3,0.8
