title,type,director,cast,country,date_added,release_year,rating,duration,listed_in,title_length,genres_count,score
AJIN: Demi-Human,TV Show,,"Mamoru Miyano, Yoshimasa Hosoya, Jun Fukuyama, Hochu Otsuka, Daisuke Hirakawa, Takahiro Sakurai, Mikako Komatsu, Hiroyuki Kinoshita, Aya Suzaki",Japan,"December 27, 2016",2016,TV-MA,2 Seasons,"Anime Series, International TV Shows",15,2,0.8823529411764706
Chasing Cameron,TV Show,,"Cameron Dallas, Aaron Carpenter, Taylor Caniff, Willie Jones, Trey Schafer, Bart Bordelon, Blake Gray",United States,"December 27, 2016",2016,TV-14,1 Season,"Reality TV, Teen TV Shows",14,2,0.875
Sense8,TV Show,,"Tuppence Middleton, Brian J. Smith, Doona Bae, Max Riemelt, Naveen Andrews, Daryl Hannah, Freema Agyeman, Terrence Mann, Adam Shapiro, Max Mauff, Alfonso Herrera, Eréndira Ibarra, Aml Ameen, Jamie Clayton, Tina Desae, Miguel Ángel Silvestre, Toby Onwumere, Joe Pantoliano",United States,"December 23, 2016",2018,TV-MA,2 Seasons,"Crime TV Shows, TV Dramas, TV Mysteries",6,3,0.6666666666666666
Crazyhead,TV Show,,"Cara Theobold, Susan Wokoma, Riann Steele, Arinzé Kene, Lewis Reeves, Tony Curran",United Kingdom,"December 16, 2016",2016,TV-MA,1 Season,"British TV Shows, International TV Shows, TV Comedies",9,3,0.75
Color of Woman,TV Show,,"Jae Hee, Soo-kyung Lee, So-yi Yoon, Ji-ho Shim, Sang-Myeon Park, Joo-young Kim",South Korea,"December 15, 2016",2012,TV-PG,1 Season,"International TV Shows, Korean TV Shows, Romantic TV Shows",12,3,0.8
Goodbye My Wife,TV Show,,"Soo-hyun Hong, Si Won Ryu, Ji-yoon Park, Min-soo Kim, Julien Kang, Joo-eun Oh, Seong-mo Jeong",South Korea,"December 15, 2016",2012,TV-14,1 Season,"International TV Shows, Korean TV Shows, Romantic TV Shows",13,3,0.8125
Happy And,TV Show,,"Hee-Jin Lee, Hae-seong Kwon, Paul Stafford, Mi-ji Lee, Ik-tae Kim, Ki-hyeon Kim",South Korea,"December 15, 2016",2012,TV-14,1 Season,"International TV Shows, Korean TV Shows, TV Dramas",8,3,0.7272727272727273
Heaven's Garden,TV Show,,"Bul-am Choi, Ho-Jeong Yoo, Sae-ron Kim, Chan-hee Kang, Woo-Sung Hyun, An Seo Hyun, Ho-Jin Kim",South Korea,"December 15, 2016",2011,TV-MA,1 Season,"International TV Shows, Korean TV Shows, TV Dramas",14,3,0.8235294117647058
Ice Fantasy,TV Show,,"Feng Shaofeng, Victoria Song, Ma Tianyu, Zhang Meng, Hee-seon Kim, Gong Beibi, Shao Bing, Hu Bing, Wang Duo",China,"December 15, 2016",2016,TV-14,1 Season,"International TV Shows, TV Action & Adventure, TV Sci-Fi & Fantasy",10,3,0.7692307692307693
Immortal Classic,TV Show,,"Jae-suk Han, Sun-Young Park, Du-shim Ko, Ye-jin Lim, Jong-hwan Choi, Ha-Nui Lee, Yun-Hoo Ko, Byeong-Ki Kim, Sun-kyung Kim, Yoon-Sik Baek",South Korea,"December 15, 2016",2012,TV-14,1 Season,"International TV Shows, Korean TV Shows, TV Dramas",15,3,0.8333333333333334
InuYasha,TV Show,,"Kappei Yamaguchi, Satsuki Yukino, Kumiko Watanabe, Noriko Hidaka, Koji Tsujitani, Houko Kuwashima, Toshiyuki Morikawa, Richard Ian Cox, Moneca Stori, Paul Dobson, Kirby Morrow, Kelly Sheridan, Jillian Michaels",Japan,"December 15, 2016",2001,TV-14,2 Seasons,"Anime Series, International TV Shows",8,2,0.8
K-POP Extreme Survival,TV Show,,"Jung Eun Kim, Yu-hwan Park, Eun-ah Go, Yong Hwan Kwak, Jin Hyuk",South Korea,"December 15, 2016",2012,TV-14,1 Season,"International TV Shows, Korean TV Shows, Romantic TV Shows",20,3,0.8695652173913043
Merlin,TV Show,James Hawes,"Colin Morgan, Bradley James, Katie McGrath, Angel Coulby, Richard Wilson, Anthony Head, John Hurt, Nathaniel Parker",United Kingdom,"December 15, 2016",2012,TV-PG,5 Seasons,"British TV Shows, International TV Shows, TV Action & Adventure",6,3,0.6666666666666666
Miss Panda & Mr. Hedgehog,TV Show,,"Dong-hae Lee, Seung-ah Yoon, Jin-hyuk Choi, So-young Yoo, Yeo-jin Hong, Min-jin Jung",South Korea,"December 15, 2016",2012,TV-PG,1 Season,"International TV Shows, Korean TV Shows, Romantic TV Shows",21,3,0.875
Tokyo Trial,TV Show,,"Marcel Hensema, Paul Freeman, Irrfan Khan, Stacy Keach, Michael Ironside, Stephen McHattie, Shinya Tsukamoto","Canada, Japan, Netherlands","December 13, 2016",2017,TV-MA,1 Season,"International TV Shows, TV Dramas",10,2,0.8333333333333334
Captive,TV Show,,,United Kingdom,"December 9, 2016",2016,TV-MA,1 Season,"Crime TV Shows, Docuseries",7,2,0.7777777777777778
White Rabbit Project,TV Show,,"Tory Belleci, Kari Byron, Grant Imahara",United States,"December 9, 2016",2016,TV-14,1 Season,"Docuseries, International TV Shows, Reality TV",18,3,0.8571428571428571
Miss in Kiss,TV Show,,"Esther Wu, Dino Lee, Gong Yi Teng, Xi Wei Lun, Honduras, Vega Tsai, Shen Chang Hung",Taiwan,"December 8, 2016",2016,TV-14,1 Season,"International TV Shows, Romantic TV Shows, TV Comedies",10,3,0.7692307692307693
The Cuba Libre Story,TV Show,,,"France, Germany","December 8, 2016",2015,TV-14,1 Season,"Docuseries, International TV Shows",17,2,0.8947368421052632
From Dusk Till Dawn,TV Show,,"D.J. Cotrona, Zane Holtz, Eiza Gonzalez, Jesse Garcia, Madison Davenport, Brandon Soo Hoo, Wilmer Valderrama, Robert Patrick, Jake Busey, Samantha Esteban, Don Johnson",United States,"December 5, 2016",2016,TV-MA,3 Seasons,"Classic & Cult TV, TV Action & Adventure, TV Horror",16,3,0.8421052631578947
Lost & Found Music Studios,TV Show,,"Victoria Baldesarra, Sarah Carmosino, Jordan Clark, DeShaun Clarke, Keara Graves, Katrina Hachey, Shane Harte, Ali Milner, Levi Randall, Brittany Raymond, Trevor Tordjman, Michael Torontow, Alex Zaichkowski, Matthew Bacik, Alyssa Baker, Ella Jonas Farlinger, Ian Matthews, Rakim Kelly, Bailey Pelkman, Olivia Solo",Canada,"December 3, 2016",2016,TV-G,2 Seasons,"Kids' TV, TV Comedies, TV Dramas",22,3,0.88
Back to 1989,TV Show,,"Marcus Chang, Ivy Shao, Mini Tsai, Yorke Sun, Ray Yang, Chang Chieh",Taiwan,"December 1, 2016",2016,TV-PG,1 Season,"International TV Shows, Romantic TV Shows, TV Comedies",10,3,0.7692307692307693
Bromance,TV Show,,"Baron Chen, Megan Lai, Bii, Katie Chen, Sean Lee",Taiwan,"December 1, 2016",2015,TV-PG,1 Season,"International TV Shows, Romantic TV Shows, TV Comedies",8,3,0.7272727272727273
Refresh Man,TV Show,,"Aaron Yan, Joanne Tseng, Lene Lai, Jack Lee, JR",Taiwan,"December 1, 2016",2016,TV-14,1 Season,"International TV Shows, Romantic TV Shows, TV Comedies",10,3,0.7692307692307693
Gilmore Girls: A Year in the Life,TV Show,,"Lauren Graham, Alexis Bledel, Kelly Bishop, Scott Patterson, Yanic Truesdale, Matt Czuchry, Liza Weil, Milo Ventimiglia, Sean Gunn, Keiko Agena, Rose Abdoo, Melissa McCarthy",United States,"November 25, 2016",2016,TV-14,1 Season,"TV Comedies, TV Dramas, Teen TV Shows",27,3,0.9
La Niña,TV Show,,"Ana María Estupiñán, Sebastian Eslava, Juan Sebastián Aragón, Diego Vásquez, Carlos Velazquez, Marcela Benjumea, Melisa Caceres, Michelle Orozco, Alberto Cardeño, Constanza Camelo, Fernando Arévalo",Colombia,"November 18, 2016",2016,TV-MA,1 Season,"Crime TV Shows, International TV Shows, Spanish-Language TV Shows",6,3,0.6666666666666666
Paranoid,TV Show,,"Indira Varma, Robert Glenister, Dino Fetscher, Neil Stuke, Christiane Paul, Lesley Sharp, Kevin Doyle",United Kingdom,"November 17, 2016",2016,TV-MA,1 Season,"British TV Shows, Crime TV Shows, International TV Shows",8,3,0.7272727272727273
Einsatzgruppen: The Nazi Death Squads,TV Show,,Paul Bandey,France,"November 10, 2016",2009,TV-MA,1 Season,"Docuseries, International TV Shows",33,2,0.9428571428571428
Case,TV Show,,"Steinunn Ólína Þorsteinsdóttir, Magnús Jónsson, Þorsteinn Bachmann, Jóhanna Vigdís Arnardóttir, Birna Rún Eiríksdóttir, Elma Stefania Agustsdottir, Bergur Þór Ingólfsson, Halldóra Geirharðsdóttir, Arnar Jónsson, Davíð Freyr Þórunnarson, Björn Stefánsson, Nína Dögg Filippusdóttir, Hjortur Jóhann Jónsson",Iceland,"November 9, 2016",2015,TV-MA,1 Season,"Crime TV Shows, International TV Shows, TV Dramas",4,3,0.5714285714285714
Danger Mouse,TV Show,,"Alexander Armstrong, Kevin Eldon, Stephen Fry, Ed Gaughan, Shauna Macdonald, Dave Lamb, Morwenna Banks",United Kingdom,"November 9, 2016",2016,TV-Y7,2 Seasons,"British TV Shows, Kids' TV",11,2,0.8461538461538461
Inborn Pair,TV Show,,"Annie Chen, Chris Wang, Hsieh Kun Da, Puff Kuo, Jennifer Hong",Taiwan,"November 1, 2016",2011,TV-14,1 Season,"International TV Shows, Romantic TV Shows, TV Comedies",10,3,0.7692307692307693
Just You,TV Show,,"Aaron Yan, Puff Kuo, Katherine Wang, Dean Fujioka, Lyla Lin, Lin Yu-pin",Taiwan,"November 1, 2016",2013,TV-14,1 Season,"International TV Shows, Romantic TV Shows, TV Comedies",7,3,0.7
Love Around,TV Show,,"George Hu, Annie Chen, Mandy Tao, Jack Lee, Tan Ai-Chen, Jian Chang, Wang Chuan",Taiwan,"November 1, 2016",2013,TV-14,1 Season,"International TV Shows, Romantic TV Shows, TV Comedies",10,3,0.7692307692307693
Love Family,TV Show,,"Chris Wang, Serena Fang, Jack Lee, Amanda Chou, Yin Fu, Rabbit Yang, Meng-sheng Shen",Taiwan,"November 1, 2016",2013,TV-MA,1 Season,"International TV Shows, Romantic TV Shows, TV Comedies",10,3,0.7692307692307693
Love Me or Leave Me,TV Show,,"Ann Hsu, Chris Wang, Alan Kuo, K'ang-i Lee, Albee Huang",Taiwan,"November 1, 2016",2012,TV-14,1 Season,"International TV Shows, Romantic TV Shows, TV Comedies",15,3,0.8333333333333334
Love Now,TV Show,,"Annie Chen, George Hu, Bobby Dou, Vivi Lee, Harry Chang, Esther Yang, Mandy Wei",Taiwan,"November 1, 2016",2012,TV-14,1 Season,"International TV Shows, Romantic TV Shows, TV Comedies",7,3,0.7
Trailer Park Boys: Out of the Park: Europe,TV Show,,"Mike Smith, John Paul Tremblay, Robb Wells",Canada,"October 28, 2016",2016,TV-MA,1 Season,"International TV Shows, TV Comedies",35,2,0.9459459459459459
Containment,TV Show,,"David Gyasi, Christina Marie Moses, Chris Wood, Kristen Gutoskie, Claudia Black, George Young, Hanna Mangan Lawrence, Trevor St. John",United States,"October 21, 2016",2016,TV-MA,1 Season,"TV Dramas, TV Thrillers",11,2,0.8461538461538461
DEATH NOTE,TV Show,,"Kappei Yamaguchi, Alessandro Juliani, Mamoru Miyano, Brad Swaile, Ai Satou, Saffron Henderson, Akeno Watanabe, Lisa Ann Beley, Aya Hirano, Shannon Chan-Kent, Haruka Kudo, Kelly Metzger, Hideo Ishikawa, Brian Dobson, Hiroki Takahashi, Sam Vincent, Shido Nakamura, Brian Drummond, Naoya Uchida, Chris Britton",Japan,"October 15, 2016",2006,TV-14,1 Season,"Anime Series, Crime TV Shows, International TV Shows",9,3,0.75
Spotless,TV Show,,"Marc-André Grondin, Denis Ménochet, Miranda Raison, Doug Allen, Liam Garrigan, Ciarán Owens, Kate Magowan, Tanya Fear, Naomi Radcliffe, Lucy Akhurst, Jemma Donovan, Niall Hayes, Brendan Coyle","United Kingdom, France","October 15, 2016",2015,TV-MA,1 Season,"Crime TV Shows, International TV Shows, TV Dramas",8,3,0.7272727272727273
Vampire Knight,TV Show,,"Daisuke Kishio, Ezra Weisz, Mamoru Miyano, Vic Mignogna, Yui Horie, Mela Lee, Risa Mizuno, Stephanie Sheh, Junichi Suwabe, Troy Baker, Jun Fukuyama, Bryce Papenbrook, Mai Nakahara, Laura Bailey, Soichiro Hoshi, Steve Staley, Susumu Chiba, Spike Spencer, Hiroki Yasumoto, Travis Willingham, Fumiko Orikasa, Wendee Lee",Japan,"October 15, 2016",2008,TV-14,2 Seasons,"Anime Series, International TV Shows, Romantic TV Shows",13,3,0.8125
StoryBots Super Songs,TV Show,,"Judy Greer, Jeff Gill, Erin Fitzgerald, Fred Tatasciore, Gregg Spiridellis",United States,"October 7, 2016",2016,TV-Y,1 Season,Kids' TV,19,1,0.95
Be with Me,TV Show,,"Jason Tsou, Queen Wei, River Huang, Fabien Yang, Tang Chen-Kang, Figaro Tseng",Taiwan,"October 1, 2016",2015,TV-PG,1 Season,"International TV Shows, Romantic TV Shows, TV Dramas",8,3,0.7272727272727273
Be with You,TV Show,,"Bobby Dou, Peijia Huang, Nylon Chen, Vivi Lee, Edison Wang, Serena Fang",Taiwan,"October 1, 2016",2015,TV-14,1 Season,"International TV Shows, Romantic TV Shows, TV Dramas",9,3,0.75
Fall in Love with Me,TV Show,,"Aaron Yan, Tia Lee, Jack Lee, Katherine Wang, Beatrice Fang, Vince Kao, Chen Bor Jeng",Taiwan,"October 1, 2016",2014,TV-14,1 Season,"International TV Shows, Romantic TV Shows, TV Comedies",16,3,0.8421052631578947
Love Cheque Charge,TV Show,,"George Hu, Phoebe Yuan, Hsieh Kun Da, Jay Shih, Smile Weng, Jet Chao, Jessie Chang",Taiwan,"October 1, 2016",2014,TV-14,1 Season,"International TV Shows, Romantic TV Shows, TV Comedies",16,3,0.8421052631578947
Masha's Spooky Stories,TV Show,,,"United States, Russia","October 1, 2016",2012,TV-Y,1 Season,Kids' TV,20,1,0.9523809523809523
Murphy's Law of Love,TV Show,,"Danson Tang, Chia-ying Lee, Jolin Chien, Jenna Wang, Meng-sheng Shen, Wen-lin Fang, Wei Lin, Phoebe Huang",Taiwan,"October 1, 2016",2015,TV-PG,1 Season,"International TV Shows, Romantic TV Shows, TV Comedies",17,3,0.85
Old Money,TV Show,David Schalko,"Udo Kier, Sunnyi Melles, Nicholas Ofczarek, Manuel Rubey, Nora von Waldstätten, Thomas Stipsits, Ursula Strauss, Robert Palfrader, Simon Schwarz, Johannes Krisch, Lukas Miko",United States,"October 1, 2016",2015,TV-MA,1 Season,"International TV Shows, TV Comedies, TV Dramas",8,3,0.7272727272727273
Someone Like You,TV Show,,"Kingone Wang, Lorene Ren, Sean Lee, Nita Lei, William Liao",Taiwan,"October 1, 2016",2015,TV-14,1 Season,"International TV Shows, Romantic TV Shows, TV Dramas",14,3,0.8235294117647058
When I See You Again,TV Show,,"Jasper Liu, Mandy Wei, Jet Chao, Ivy Shao, Tina Chou, Kao Meng-Chieh",Taiwan,"October 1, 2016",2015,TV-14,1 Season,"International TV Shows, Romantic TV Shows, TV Comedies",16,3,0.8421052631578947
VeggieTales in the House,TV Show,,"Phil Vischer, Mike Nawrocki, Rob Paulsen, Tress MacNeille",United States,"September 23, 2016",2016,TV-Y,4 Seasons,Kids' TV,21,1,0.9545454545454546
Chef's Table: France,TV Show,,,,"September 2, 2016",2016,TV-14,1 Season,Docuseries,18,1,0.9473684210526315
Kulipari: An Army of Frogs,TV Show,,"Mark Hamill, Keith David, Wendie Malick, Josh Keaton, Mikey Kelley, Phil LaMarr, Laraine Newman, Jess Harnell, Charles Adler, Amy Margolis, Cree Summer, Lacey Chabert, Rolonda Watts, Kevin Michael Richardson, Candi Milo",United States,"September 2, 2016",2016,TV-Y7,1 Season,Kids' TV,22,1,0.9565217391304348
Conspiracy,TV Show,,Mark Bazeley,United Kingdom,"September 1, 2016",2015,TV-14,1 Season,"British TV Shows, Docuseries",10,2,0.8333333333333334
Dead Set,TV Show,,"Jaime Winstone, Andy Nyman, Kevin Eldon, Davina McCall, Warren Brown, Riz Ahmed, Beth Cordingly, Kathleen McDermott, Raj Ghatak",United Kingdom,"September 1, 2016",2008,TV-MA,1 Season,"British TV Shows, TV Horror, TV Thrillers",7,3,0.7
Forensic Files,TV Show,,Peter Thomas,United States,"September 1, 2016",2011,TV-MA,9 Seasons,"Crime TV Shows, Docuseries, Science & Nature TV",13,3,0.8125
The Fierce Wife,TV Show,,"Sonia Sui, James Wen, Amanda Chu, Chris Wang, Karen Ying-Chen Hu, Patrick Lee, Janel Tsai, Li-li Pan, Fu Lei",Taiwan,"September 1, 2016",2010,TV-MA,1 Season,"International TV Shows, Romantic TV Shows, TV Dramas",13,3,0.8125
Witches: A Century of Murder,TV Show,,Suzannah Lipscomb,United Kingdom,"September 1, 2016",2015,TV-14,1 Season,"British TV Shows, Crime TV Shows, Docuseries",24,3,0.8888888888888888
Glitter Force,TV Show,,"Laura Bailey, Kate Higgins, Alex Cazares, Colleen O'Shaughnessey, Danielle Nicole, Debi Derryberry, Mary Elizabeth McGlynn, Patrick Seitz, Keith Silverstein",Japan,"August 26, 2016",2016,TV-Y7,2 Seasons,"Anime Series, Kids' TV",12,2,0.8571428571428571
Behind Enemy Lines,TV Show,,,United States,"August 15, 2016",2001,TV-14,1 Season,"British TV Shows, Docuseries",16,2,0.8888888888888888
Caught on Camera,TV Show,,Nick Wallis,United Kingdom,"August 15, 2016",2015,TV-MA,3 Seasons,"British TV Shows, Crime TV Shows, Docuseries",14,3,0.8235294117647058
Cocaine,TV Show,,,United Kingdom,"August 1, 2016",2005,TV-14,1 Season,"British TV Shows, Crime TV Shows, Docuseries",7,3,0.7
Edge of the Universe,TV Show,,,United Kingdom,"August 1, 2016",2008,TV-G,1 Season,"British TV Shows, Docuseries, Science & Nature TV",17,3,0.85
La Esclava Blanca,TV Show,,"Nerea Camacho, Orián Suárez, Miguel de Miguel, Modesto Lacen, Norma Martínez, Ricardo Vesga, Viña Machado, Andrés Suárez, Natasha Klauss, Miroslava Morales",Colombia,"August 1, 2016",2016,TV-MA,1 Season,"International TV Shows, Spanish-Language TV Shows, TV Dramas",15,3,0.8333333333333334
LEGO Bionicle: The Journey to One,TV Show,,"Nolan Balzer, Paolo Bryant, Jacqui Fox, Quinn Greene, Geoff Hughes, Cory Hunter, William Jordan, Corny Rempel, Michael Strickland",United States,"July 29, 2016",2016,TV-Y7,2 Seasons,Kids' TV,28,1,0.9655172413793104
Popples,TV Show,,"Erin Fitzgerald, Wendee Lee, Cassandra Morris, Cindy Robinson, Reba Buhr, Ben Diskin, Ezra Weisz, Karen Strassman","United States, France","July 24, 2016",2016,TV-Y,3 Seasons,Kids' TV,7,1,0.875
Kuromukuro,TV Show,Tensai Okamura,"Yohei Azakami, M・A・O, Reina Ueda, Asami Seto, Kaito Ishikawa, Yusuke Kobayashi, Shunsuke Takeuchi, Manami Sugihira, Momo Asakura, Kanako Tojo, Ryohei Kimura, Hikaru Ueda, Taiten Kusunoki",Japan,"July 4, 2016",2016,TV-14,2 Seasons,"Anime Series, International TV Shows",10,2,0.8333333333333334
Marco Polo,TV Show,,"Lorenzo Richelmy, Benedict Wong, Chin Han, Joan Chen, Michelle Yeoh, Rick Yune, Claudia Kim, Remy Hii, Zhu Zhu, Tom Wu, Mahesh Jadu, Olivia Cheng, Uli Latukefu, Pierfrancesco Favino, Jacqueline Chan, Leonard Wu, Gabriel Byrne",United States,"July 1, 2016",2016,TV-MA,2 Seasons,"TV Action & Adventure, TV Dramas",9,2,0.8181818181818182
Justin Time GO!,TV Show,,"Drew Davis, Scott McCord, Jenna Warren",,"June 24, 2016",2016,TV-Y,1 Season,Kids' TV,13,1,0.9285714285714286
Hibana: Spark,TV Show,,"Kento Hayashi, Kazuki Namioka, Mugi Kadowaki, Masao Yoshii, Hideaki Murata, Nahana, Sayaka Yamamoto, Shota Sometani, Tomorowo Taguchi, Kaoru Kobayashi",Japan,"June 2, 2016",2016,TV-MA,1 Season,"International TV Shows, TV Dramas",12,2,0.8571428571428571
72 Cutest Animals,TV Show,,,Australia,"June 1, 2016",2016,TV-PG,1 Season,"Docuseries, International TV Shows, Science & Nature TV",15,3,0.8333333333333334
72 Dangerous Places to Live,TV Show,,Mitch Ryan,Australia,"June 1, 2016",2016,TV-PG,1 Season,"Docuseries, International TV Shows, Science & Nature TV",23,3,0.8846153846153846
Cyborg 009 VS Devilman,TV Show,,"Jun Fukuyama, Shintaro Asanuma, Haruka Shiraishi, Tomoaki Maeno, M・A・O, Hiroki Touchi, Takeshi Koyama, Yu Mizushima, Hozumi Goda, Ayumu Okamura, Saori Hayami, Satoshi Hino, Johnny Yong Bosch, Bryce Papenbrook, Christine Marie Cabanos, Spike Spencer, Stephanie Sheh, Michael Sinterniklaas, Keith Silverstein, Joey Lotsko, Tony Azzolino, Steve Staley, Cristina Vee, Christopher Corey Smith","Japan, United States","April 1, 2016",2015,TV-MA,1 Season,"Anime Series, International TV Shows",19,2,0.9047619047619048
Justin Time,TV Show,,"Gage Munroe, Scott McCord, Jenna Warren",Canada,"April 1, 2016",2012,TV-Y,2 Seasons,Kids' TV,10,1,0.9090909090909091
Terrace House: Boys & Girls in the City,TV Show,,"You, Reina Triendl, Ryota Yamasato, Yoshimi Tokui, Azusa Babazono, Ayumu Mochizuki, Kentaro",Japan,"April 1, 2016",2016,TV-14,2 Seasons,"International TV Shows, Reality TV",32,2,0.9411764705882353
Netflix Presents: The Characters,TV Show,,"Lauren Lapkus, John Early, Henry Zebrowski, Kate Berlant, Natasha Rothwell, Paul W. Downs, Tim Robinson, Dr. Brown",United States,"March 11, 2016",2016,TV-MA,1 Season,TV Comedies,29,1,0.9666666666666667
Your lie in April,TV Show,,"Natsuki Hanae, Risa Taneda, Ayane Sakura, Ryota Osaka, Saori Hayami, Yuki Kaji",Japan,"March 1, 2016",2014,TV-14,1 Season,"Anime Series, International TV Shows, Romantic TV Shows",14,3,0.8235294117647058
Cooked,TV Show,,Michael Pollan,United States,"February 19, 2016",2016,TV-14,1 Season,Docuseries,6,1,0.8571428571428571
Care Bears & Cousins,TV Show,,"Michael Sinterniklaas, Michaela Dean, Doug Erholtz, Braeden Fox, Olivia Hack, David Lodge, Nayo Wallace, Ryan Wiesbrock",United States,"February 5, 2016",2016,TV-Y,2 Seasons,Kids' TV,17,1,0.9444444444444444
Turbo FAST,TV Show,,"Reid Scott, John Eric Bentley, Amir Talai, Phil LaMarr, Grey DeLisle, Michael Patrick Bell, Eric Bauza",United States,"February 5, 2016",2016,TV-Y7,3 Seasons,Kids' TV,9,1,0.9
Masha's Tales,TV Show,,,,"February 1, 2016",2012,TV-Y,1 Season,Kids' TV,12,1,0.9230769230769231
Chelsea Does,TV Show,,Chelsea Handler,United States,"January 23, 2016",2016,TV-MA,1 Season,"Docuseries, Science & Nature TV",11,2,0.8461538461538461
Sammy & Co,TV Show,,,France,"December 25, 2015",2014,TV-Y,1 Season,"Kids' TV, TV Comedies",8,2,0.8
Atelier,TV Show,,"Mirei Kiritani, Mao Daichi, Wakana Sakai, Masako Chiba, Maiko, Ken Kaito, Dori Sakurada, Nicole Ishida, Mayuko Kawakita",Japan,"December 1, 2015",2015,TV-PG,1 Season,"International TV Shows, TV Dramas",7,2,0.7777777777777778
W/ Bob & David,TV Show,,"David Cross, Bob Odenkirk, John Ennis, Jay Johnston, Brian Posehn, Jill Talley, Paul F. Tompkins, Tom Kenny, Brett Paesel",United States,"November 13, 2015",2015,TV-MA,1 Season,TV Comedies,11,1,0.9166666666666666
Hemlock Grove,TV Show,Eli Roth,"Famke Janssen, Landon Liboiron, Dougray Scott, Bill Skarsgård, Joel de la Fuente, Kaniehtiio Horn, Madeleine Martin, Michael Andreae, Penelope Mitchell, Freya Tingley, Laurie Fortier, Nicole Boivin, Ted Dykstra, Lili Taylor, Aaron Douglas, Kandyse McClure, Marty Adams, Demore Barnes, Madeline Brewer",United States,"October 23, 2015",2015,TV-MA,3 Seasons,"TV Horror, TV Mysteries, TV Thrillers",12,3,0.8
Wakfu: The Quest for the Six Eliatrope Dofus,TV Show,,"Fanny Bloc, Jules De Jongh, Patrick Béthune, Hugo Chandor, Adeline Chetail, Jessica Bell, Thomas Guitard, Ross Grant, Geneviève Doang",,"October 1, 2015",2014,TV-PG,1 Season,Kids' TV,37,1,0.9736842105263158
Wet Hot American Summer,TV Show,,"Elizabeth Banks, Lake Bell, H. Jon Benjamin, Michael Ian Black, Michael Cera, Josh Charles, Bradley Cooper, Judah Friedlander, Janeane Garofalo, Jon Hamm, Nina Hellman, Joe Lo Truglio, Ken Marino, Christopher Meloni, A.D. Miles, Marguerite Moreau, Zak Orth, Jordan Peele, David Hyde Pierce, Chris Pine, Amy Poehler, Paul Rudd, Marisa Ryan, Jason Schwartzman, Molly Shannon, Michael Showalter, John Slattery, Kevin Sussman, David Wain, Kristen Wiig",United States,"July 31, 2015",2015,TV-MA,1 Season,TV Comedies,20,1,0.9523809523809523
H2O: Mermaid Adventures,TV Show,,"Sonja Ball, Holly Gauthier-Frankel, Thor Bishopric, Angela Galuppo","Germany, Australia, France, China","July 15, 2015",2015,TV-Y7,2 Seasons,Kids' TV,21,1,0.9545454545454546
Danger Mouse: Classic Collection,TV Show,,"David Jason, Terry Scott, Edward Kelsey, Brian Trueman",United Kingdom,"June 15, 2015",1992,TV-Y,10 Seasons,"British TV Shows, Kids' TV, TV Comedies",29,3,0.90625
Oscar's Oasis,TV Show,,,France,"March 15, 2015",2011,TV-Y,1 Season,Kids' TV,12,1,0.9230769230769231
Lilyhammer,TV Show,,"Steven Van Zandt, Trond Fausa, Steinar Sagen, Robert Skjærstad, Tommy Karlsen, Fridtjov Såheim, Marian Saastad Ottesen","Norway, United States","November 21, 2014",2014,TV-MA,3 Seasons,"Crime TV Shows, TV Comedies, TV Dramas",10,3,0.7692307692307693
Goosebumps,TV Show,,R.L. Stine,Canada,"November 19, 2014",1998,TV-G,5 Seasons,"Kids' TV, TV Thrillers",10,2,0.8333333333333334
The Borgias,TV Show,,"Jeremy Irons, François Arnaud, Holliday Grainger, Peter Sullivan, Sean Harris, Joanne Whalley, Lotte Verbeek, Colm Feore, Vernon Dobtcheff, David Oakes","United States, Hungary, Ireland, Canada","February 1, 2014",2013,TV-MA,3 Seasons,TV Dramas,10,1,0.9090909090909091
The 4400,TV Show,,"Joel Gretsch, Jacqueline McKenzie, Patrick John Flueger, Conchita Campbell, Chad Faust, Richard Kahan, Mahershala Ali, Billy Campbell","United States, United Kingdom","September 1, 2013",2007,TV-14,4 Seasons,"TV Dramas, TV Mysteries, TV Sci-Fi & Fantasy",7,3,0.7
Breaking Bad,TV Show,,"Bryan Cranston, Aaron Paul, Anna Gunn, Dean Norris, Betsy Brandt, R.J. Mitte, Bob Odenkirk, Steven Michael Quezada, Jonathan Banks, Giancarlo Esposito",United States,"August 2, 2013",2013,TV-MA,5 Seasons,"Crime TV Shows, TV Dramas, TV Thrillers",11,3,0.7857142857142857
Feb-09,TV Show,,"Shahd El Yaseen, Shaila Sabt, Hala, Hanadi Al-Kandari, Salma Salem, Ibrahim Al-Harbi, Mahmoud Boushahri, Yousef Al Balushi, Ghorour, Abdullah Al-bloshi",,"March 20, 2019",2018,TV-14,1 Season,"International TV Shows, TV Dramas",6,2,0.75
แผนร้ายนายเจ้าเล่ห์,TV Show,,"Chutavuth Pattarakampol, Sheranut Yusananda, Nichaphat Chatchaipholrat, Thassapak Hsu",,"March 30, 2019",2016,TV-14,1 Season,"International TV Shows, Romantic TV Shows, TV Comedies",19,3,0.8636363636363636
Şubat,TV Show,,"Alican Yücesoy, Melisa Sözen, Musa Uzunlar, Serkan Ercan, Özkan Uğur, Ülkü Duru, Tansu Biçer, Nadir Sarıbacak, Sermet Yeşil, Ayhan Kavas",Turkey,"January 17, 2017",2013,TV-MA,1 Season,"Crime TV Shows, International TV Shows, TV Dramas",5,3,0.625
100% Hotter,TV Show,,"Daniel Palmer, Melissa Sophia, Karen Williams, Grace Woodward",United Kingdom,"November 1, 2019",2017,TV-14,1 Season,"British TV Shows, International TV Shows, Reality TV",10,3,0.7692307692307693
12 Years Promise,TV Show,,"So-yeon Lee, Namkoong Min, Tae-im Lee, So-hui Yoon, Won-keun Lee, Hyo-young Ryu",South Korea,"May 22, 2017",2014,TV-14,1 Season,"International TV Shows, Korean TV Shows, Romantic TV Shows",14,3,0.8235294117647058
21 Sarfarosh: Saragarhi 1897,TV Show,,"Luke Kenny, Mohit Raina, Mukul Dev",India,"December 1, 2018",2018,TV-14,1 Season,"International TV Shows, TV Dramas",25,2,0.9259259259259259
7 (Seven),TV Show,Nizar Shafi,"Rahman, Havish, Regina Cassandra, Nandita Swetha, Anisha Ambrose, Tridha Choudhury, Pujitha Ponnada, Aditi Arya",India,"July 30, 2019",2019,TV-14,1 Season,TV Shows,8,1,0.8888888888888888
9 Months That Made You,TV Show,,Demetri Goritsas,United States,"March 1, 2017",2016,TV-PG,1 Season,"British TV Shows, Docuseries, Science & Nature TV",18,3,0.8571428571428571
A Good Wife,TV Show,,"Tien Hsin, Christopher Lee, Darren Chiu, Shara Lin, Blaire Chang, Xi Man-Ning, Chu De-Kang",Taiwan,"January 1, 2017",2013,TV-14,1 Season,"International TV Shows, Romantic TV Shows, TV Dramas",9,3,0.75
