title,type,director,cast,country,date_added,release_year,rating,duration,listed_in,title_length,genres_count,score
60 Days In,TV Show,,,United States,"November 1, 2020",2019,TV-MA,1 Season,Reality TV,8,1,0.8888888888888888
Dawson's Creek,TV Show,,"James Van Der Beek, Katie Holmes, Michelle Williams, Joshua Jackson, Kerr Smith, Meredith Monroe, Busy Philipps, Mary Beth Peil",United States,"November 1, 2020",2002,TV-14,6 Seasons,"Romantic TV Shows, TV Dramas, Teen TV Shows",13,3,0.8125
Forged in Fire,TV Show,,Wil Willis,United States,"November 1, 2020",2019,TV-14,1 Season,Reality TV,12,1,0.9230769230769231
Leah Remini: Scientology and the Aftermath,TV Show,,"Leah Remini, Mike Rinder",United States,"November 1, 2020",2018,TV-14,3 Seasons,Docuseries,37,1,0.9736842105263158
LEGO Jurassic World: Legend of Isla Nublar,TV Show,,,United States,"November 1, 2020",2019,TV-Y,1 Season,Kids' TV,36,1,0.972972972972973
LEGO Jurassic World: Secret Exhibit,TV Show,,"Britt McKillip, Ian Hanlin, Dhirendra, Alex Zahara, Vincent Tong, Bethany Brown, Adrian Petriw, Sabrina Pitre",United States,"November 1, 2020",2018,TV-Y,1 Season,Kids' TV,31,1,0.96875
LEGO Ninjago,TV Show,,"Michael Adamthwaite, Paul Dobson, Kelly Metzger, Brent Miller, Kirby Morrow, Pauline Newstone, Vincent Tong, Sam Vincent",Canada,"November 1, 2020",2020,TV-Y7,2 Seasons,Kids' TV,11,1,0.9166666666666666
LEGO Ninjago: Masters of Spinjitzu,TV Show,,"Vincent Tong, Jillian Michaels, Ian James Corlett, John Novak, Paul Dobson, Michael Adamthwaite, Kelly Metzger, Brent Miller, Kirby Morrow, Brian Drummond, Mark Oliver, Michael Kopsa","Denmark, Singapore, Canada, United States","November 1, 2020",2019,TV-Y7,10 Seasons,Kids' TV,30,1,0.967741935483871
LEGO: CITY Adventures,TV Show,,"Joe Zieja, Misty Lee, Alex Cazares, Daniel MK Cohen, James Arnold Taylor, Roger Craig Smith, Mick Lauer","United States, France, Denmark","November 1, 2020",2019,TV-Y,1 Season,"Kids' TV, TV Comedies",19,2,0.9047619047619048
The Garfield Show,TV Show,,"Frank Welker, Wally Wingert, Gregg Berger","France, United States","November 1, 2020",2018,TV-Y,4 Seasons,"Kids' TV, TV Comedies",15,2,0.8823529411764706
The Good Detective,TV Show,,"Son Hyun-joo, Jang Seung-jo, Lee Elijah, Oh Jung-se",South Korea,"November 1, 2020",2020,TV-MA,1 Season,"Crime TV Shows, International TV Shows, TV Dramas",16,3,0.8421052631578947
Voice,TV Show,,"Jang Hyuk, Lee Ha-na, Baek Sung-hyun, Ye-sung, Son Eun-seo, Kwon Jae-hwan, Lee Ju-seung, Kim Jae-wook",South Korea,"November 1, 2020",2018,TV-14,2 Seasons,"Crime TV Shows, International TV Shows, Korean TV Shows",5,3,0.625
Afronta! Facing It!,TV Show,Juliana Vicente,"Loo Nascimento, Ingrid Silva, Rincon Sapiência, Batekoo, Gabriel Martins, Benjamin Abras, Daniele DaMata, Tasha & Tracie Okereke, Mariana de Matos, André Novais, Mahal Pita, Grace Passô, Thamyra Thâmara, Xenia França, Criola, Dani Ornellas, Anelis Assumpção, Magá Moura, Tássia Reis, Liniker, Yasmin Thayná, Raquel Virgínia, Juliana Luna, Erica Malunguinho, Diane Lima, Karol Conká",Brazil,"October 31, 2020",2017,TV-PG,1 Season,"Docuseries, International TV Shows",17,2,0.8947368421052632
Zumbo's Just Desserts,TV Show,,"Adriano Zumbo, Rachel Khoo",Australia,"October 31, 2020",2019,TV-PG,1 Season,"International TV Shows, Reality TV",19,2,0.9047619047619048
Kongsuni and Friends,TV Show,,"Hong So-yeong, Choi Bo-bae, Kim Eun-ah, Jeong Hye-won, Bae Jin-hong, Um Sang-hyun, Cha Moo-jin, Jang Min-young, Jang Do-young, Kim Sook-young, Park Ran, Kim Chang-won, Park Yeon-kyung",,"October 30, 2020",2020,TV-Y,2 Seasons,"Kids' TV, Korean TV Shows",18,2,0.9
Marvel's Agents of S.H.I.E.L.D.,TV Show,,"Clark Gregg, Ming-Na Wen, Brett Dalton, Chloe Bennet, Iain De Caestecker, Elizabeth Henstridge, Adrianne Palicki, Luke Mitchell, Henry Simmons",United States,"October 30, 2020",2020,TV-14,7 Seasons,"TV Action & Adventure, TV Sci-Fi & Fantasy",28,2,0.9333333333333333
Somebody Feed Phil,TV Show,,Philip Rosenthal,United States,"October 30, 2020",2020,TV-14,4 Seasons,"Docuseries, Reality TV",16,2,0.8888888888888888
Suburra: Blood on Rome,TV Show,,"Alessandro Borghi, Giacomo Ferrara, Eduardo Valdarnini, Francesco Acquaroli, Filippo Nigro, Claudia Gerini, Adamo Dionisi, Barbara Chichiarelli, Federico Tocci, Gerasimos Skiadaresis, Elisabetta De Palo, Carlotta Antonelli, Renato Marchetti, Paola Sotgiu",Italy,"October 30, 2020",2020,TV-MA,3 Seasons,"Crime TV Shows, International TV Shows, TV Dramas",19,3,0.8636363636363636
Blood of Zeus,TV Show,,"Derek Phillips, Jason O'Mara, Claudia Christian, Mamie Gummer, Jessica Henwick, Elias Toufexis, Chris Diamantopoulos, Adetokumboh M'Cormack, Matthew Mercer, Melina Kanakaredes, Danny Jacobs, Matt Lowe, Adam Croasdell, Jennifer Hale, David Shaughnessy, Fred Tatasciore, Vanessa Marshall",United States,"October 27, 2020",2020,TV-MA,1 Season,Anime Series,11,1,0.9166666666666666
Chico Bon Bon: Monkey with a Tool Belt,TV Show,,"Robbie Daymond, Dayci Brookshire, Anthony Tedesco, Andy Abbott, Roberta Lemons, Cole Seaver",United States,"October 27, 2020",2020,TV-Y,4 Seasons,Kids' TV,31,1,0.96875
The Devil Punisher,TV Show,"Chang Chin-jung, Chen Rong-hui","Mike He, Ivy Shao, Anson Chen, Jane Chang, Roy Chang, Amanda Chou, Johnny Yang, Yin Chao-te, Tan Ai-Chen, Chen Bor-jeng, Dewi Chien",Taiwan,"October 26, 2020",2020,TV-14,1 Season,"International TV Shows, Romantic TV Shows, TV Mysteries",16,3,0.8421052631578947
Barbarians,TV Show,,"Laurence Rupp, Jeanne Goursaud, David Schütter, Ronald Zehrfeld, Nicki von Tempelhoff, Bernhard Schütz, Eva Verena Müller, Sophie Rois, Gaetano Aronica, Nikolai Kinski, Jeremy Miliker",Germany,"October 23, 2020",2020,TV-MA,1 Season,"International TV Shows, TV Action & Adventure, TV Dramas",10,3,0.7692307692307693
Move,TV Show,"Thierry Demaizière, Alban Teurlai",,United States,"October 23, 2020",2020,TV-MA,1 Season,"Docuseries, International TV Shows",4,2,0.6666666666666666
Stolen Away,TV Show,,"Daniel Grao, Carolina Lapausa, Melani Olivares, Adriana Paz, Fernando Solórzano, Juan Carlos Messier, Jon Arias, Verónica Velásquez, David Trejos, Ana Maria Orozco",Spain,"October 23, 2020",2020,TV-MA,1 Season,"Crime TV Shows, International TV Shows, Spanish-Language TV Shows",10,3,0.7692307692307693
The Queen's Gambit,TV Show,,"Anya Taylor-Joy, Bill Camp, Marielle Heller, Thomas Brodie-Sangster, Moses Ingram, Harry Melling, Isla Johnston, Christiane Seidel, Rebecca Root, Chloe Pirrie, Jacob Fortune-Lloyd",United States,"October 23, 2020",2020,TV-MA,1 Season,TV Dramas,16,1,0.9411764705882353
My Next Guest Needs No Introduction With David Letterman,TV Show,,"President Barack Obama, George Clooney, Malala Yousafzai, Jay-Z, Tina Fey, Howard Stern, David Letterman",United States,"October 21, 2020",2020,TV-MA,3 Seasons,Stand-Up Comedy & Talk Shows,48,1,0.9795918367346939
Unsolved Mysteries,TV Show,,,,"October 19, 2020",2020,TV-MA,2 Seasons,"Crime TV Shows, Docuseries",17,2,0.8947368421052632
Start-Up,TV Show,,"Bae Suzy, Nam Joo-hyuk, Kim Seon-ho, Kang Han-na, Kim Do-wan, Yu Su-bin, Stephanie Lee, Kim Hae-sook, Seo Yi-sook, Song Sun-mi",South Korea,"October 18, 2020",2020,TV-14,1 Season,"International TV Shows, Romantic TV Shows, TV Comedies",8,3,0.7272727272727273
Grand Army,TV Show,,"Odessa A’zion, Odley Jean, Amir Bageria, Maliq Johnson, Amalia Yoo, Alphonso Romero Jones II, Thelonius Serrell-Freed, Anthony Ippolito, Brian Altemus",United States,"October 16, 2020",2020,TV-MA,1 Season,"TV Dramas, Teen TV Shows",9,2,0.8181818181818182
La Révolution,TV Show,,"Amir El Kacem, Marilou Aussilloux, Lionel Erdogan, Isabel Aimé Gonzalez Sola, Julien Frison, Doudou Masta, Dimitri Storoge, Amélia Lacquemant, Coline Beal, Laurent Lucas, Gaia Weiss, Chiara Tantimonaco, Nina Tantimonaco, Pierre Andrau, Philippine Martinot, Jérémie Covillault",France,"October 16, 2020",2020,TV-MA,1 Season,"International TV Shows, TV Action & Adventure, TV Dramas",12,3,0.8
Someone Has to Die,TV Show,Manolo Caro,"Carmen Maura, Cecilia Suárez, Ester Expósito, Ernesto Alterio, Alejandro Speitzer, Isaac Hernández, Carlos Cuevas, Mariola Fuentes, Pilar Castro, Juan Carlos Vellido, Eduardo Casanova, Manuel Morón, Javier Pereira","Mexico, Spain","October 16, 2020",2020,TV-MA,1 Season,"Crime TV Shows, International TV Shows, Spanish-Language TV Shows",15,3,0.8333333333333334
The Last Kids on Earth,TV Show,,"Nick Wolfhard, Charles Demers, Garland Whitt, Montse Hernandez, Brian Drummond, Giles Panton, Keith David",United States,"October 16, 2020",2020,TV-Y7,3 Seasons,"Kids' TV, TV Comedies",18,2,0.9
Fireman Sam,TV Show,,"Steven Kynman, David Carling, Tegwen Tucker, Su Douglas, Andrew Hodwitz, Dave Pender, Lily Cassano, Carter Treneer, Sarah Lynn Strange",United Kingdom,"October 15, 2020",2018,TV-Y,4 Seasons,"British TV Shows, Kids' TV",10,2,0.8333333333333334
Half & Half,TV Show,,"Rachel True, Essence Atkins, Telma Hopkins, Chico Benymon, Valarie Pettiford, Alec Mapa",United States,"October 15, 2020",2005,TV-14,4 Seasons,TV Comedies,9,1,0.9
One on One,TV Show,,"Flex Alexander, Kyla Pratt, Kelly Perine, Sicily Johnson, Robert Ri'chard",United States,"October 15, 2020",2006,TV-14,5 Seasons,"TV Comedies, Teen TV Shows",8,2,0.8
Power Rangers Beast Morphers,TV Show,,"Rorrie D. Travis, Jazz Baduwalia, Jacqueline Scislowski, Abraham Rodríguez, Teuila Blakely, Kristina Ho, Cosme Flores, Kevin Copeland",United States,"October 15, 2020",2020,TV-Y7,2 Seasons,Kids' TV,25,1,0.9615384615384616
Social Distance,TV Show,,"Danielle Brooks, Oscar Nuñez, Mike Colter, Heather Burns, Okieriete Onaodowan, Ajay Naidu, Shakira Barrera, Steven Weber, Helena Howard, Daphne Rubin-Vega, Guillermo Díaz, Miguel Sandoval, Camila Perez, Gianna Aragon, Tom Costanzo, Luca Costanzo, Olli Haaskivi, Marsha Stephanie Blake, Isabella Ferreira, Rocco Luna, Larita Brooks, Misha Brooks, Liam Foley, Zoë Verbil, Anthony Norman, Brian Jordan Alvarez, Max Jenkins, Peter Vack, Rana Roy, Peter Scanavino, Ali Ahn, Tami Sagher, Barbara Rosenblat, Michael Mulheren, Leo Bai-Scanavino, Becky Ann Baker, Dylan Baker, Marcia DeBonis, Raymond Anthony Thomas, Sunita Mani, Kylie Liya Page, David Iacono, Lachlan Riley Watson, Niles Fitch, Will Meyers, Ava DeMary, Lydia Look, Asante Blackk, Ayize Ma'at, Lovie Simone",United States,"October 15, 2020",2020,TV-MA,1 Season,"TV Comedies, TV Dramas",14,2,0.875
The Cabin with Bert Kreischer,TV Show,,"Bert Kreischer, Anthony Anderson, Caitlyn Jenner, Tom Segura, Joey Diaz, Nikki Glaser, Fortune Feimster, Bobby Lee, Donnell Rawlings, Kaley Cuoco, Joel McHale, Ms. Pat, Deon Cole, Big Jay Oakerson",United States,"October 13, 2020",2020,TV-MA,1 Season,"Reality TV, TV Comedies",25,2,0.9259259259259259
Kipo and the Age of Wonderbeasts,TV Show,,"Karen Fukuhara, Sydney Mikayla, Deon Cole, Coy Stewart, Dee Bradley Baker, Sterling K. Brown, Dan Stevens, Jake Green, Steve Blum",United States,"October 12, 2020",2020,TV-Y7,3 Seasons,"Kids' TV, TV Comedies",27,2,0.9310344827586207
Deaf U,TV Show,,,United States,"October 9, 2020",2020,TV-MA,1 Season,Docuseries,5,1,0.8333333333333334
The Haunting of Bly Manor,TV Show,,"Victoria Pedretti, Oliver Jackson-Cohen, Henry Thomas, Amelia Eve, T'Nia Miller, Rahul Kohli, Tahirah Sharif, Amelie Bea Smith, Benjamin Evan Ainsworth",United States,"October 9, 2020",2020,TV-MA,1 Season,"TV Dramas, TV Horror, TV Mysteries",21,3,0.875
Do Do Sol Sol La La Sol,TV Show,,"Go A-ra, Lee Jae-wook, Kim Ju-hun, Ye Ji-won, Lee Soon-jae, Shin Eun-soo, Seo Yi-sook",South Korea,"October 8, 2020",2020,TV-14,1 Season,"International TV Shows, Romantic TV Shows, TV Comedies",17,3,0.85
Private Lives,TV Show,,"Seohyun, Ko Kyung-pyo, Kim Hyo-jin, Kim Young-min, Tae Won-seok, Song Sun-mi, Park Seong-geun, Jang Jin-hee, Yoon Sa-bong, Lee Hak-ju, Song Sang-eun, Jang Won-hyeok, Yoo Hee-je, Min Zio, Kim Min-sang, Kim Ba-da, Cha Soo-yeon",South Korea,"October 8, 2020",2020,TV-14,1 Season,"Crime TV Shows, International TV Shows, TV Dramas",12,3,0.8
The 100,TV Show,,"Eliza Taylor, Paige Turco, Bob Morley, Marie Avgeropoulos, Christopher Larkin, Henry Ian Cusick, Isaiah Washington, Lindsey Morgan, Devon Bostick, Richard Harmon, Ricky Whittle, Jarod Joseph, Chelsey Reist, Sachin Sahel, Adina Porter","United States, Canada","October 8, 2020",2020,TV-MA,7 Seasons,"TV Action & Adventure, TV Dramas, TV Sci-Fi & Fantasy",6,3,0.6666666666666666
To the Lake,TV Show,Pavel Kostomarov,"Viktoriya Isakova, Kirill Käro, Aleksandr Robak, Natalya Zemtsova, Maryana Spivak, Yuri Kuznetsov, Eldar Kalimulin, Viktoriya Agalakova, Alexander Yatsenko, Saveliy Kudryashov",Russia,"October 7, 2020",2020,TV-MA,1 Season,"International TV Shows, TV Dramas, TV Mysteries",9,3,0.75
Bad Boy Billionaires: India,TV Show,,,India,"October 5, 2020",2020,TV-14,1 Season,"British TV Shows, Docuseries, International TV Shows",24,3,0.8888888888888888
Pat a Pat Como,TV Show,,,,"October 3, 2020",2016,TV-Y,1 Season,Kids' TV,11,1,0.9166666666666666
Qurious Como,TV Show,,,,"October 3, 2020",2017,TV-Y,1 Season,Kids' TV,11,1,0.9166666666666666
DreamWorks Happy Holidays from Madagascar,TV Show,,"Tom McGrath, Chris Miller, Christopher Knights, John DiMaggio, Ben Stiller, Chris Rock, David Schwimmer, Jada Pinkett Smith, Cedric the Entertainer, Andy Richter, Carl Reiner",United States,"October 2, 2020",2005,TV-PG,1 Season,"Kids' TV, TV Comedies",37,2,0.9487179487179487
Emily in Paris,TV Show,,"Lily Collins, Philippine Leroy-Beaulieu, Ashley Park, Lucas Bravo, Kate Walsh, Samuel Arnold, Bruno Gouery, Camille Razat",United States,"October 2, 2020",2020,TV-MA,1 Season,"Romantic TV Shows, TV Comedies, TV Dramas",12,3,0.8
H2O: Just Add Water,TV Show,,"Cariba Heine, Phoebe Tonkin, Angus McLaren, Burgess Abernethy, Claire Holt, Alan David Lee, Cleo Massey, Jamie Timony",Australia,"October 2, 2020",2009,TV-PG,3 Seasons,"Kids' TV, TV Dramas",16,2,0.8888888888888888
Evil,TV Show,,"Katja Herbers, Mike Colter, Aasif Mandvi, Michael Emerson, Christine Lahti, Kurt Fuller, Marti Matulis",United States,"October 1, 2020",2019,TV-14,1 Season,TV Dramas,4,1,0.8
Familiar Wife,TV Show,,"Ji Sung, Han Ji-min, Kang Han-na, Jang Seung-jo",South Korea,"October 1, 2020",2018,TV-MA,1 Season,"International TV Shows, Romantic TV Shows, TV Dramas",12,3,0.8
Food Wars!: Shokugeki no Soma,TV Show,,"Yoshitsugu Matsuoka, Risa Taneda, Minami Takahashi, Shizuka Ishigami, Natsuki Hanae, Yuki Ono, Takahiro Sakurai, Ai Kayano, Maaya Uchida, Taishi Murata, Yusuke Kobayashi, Saori Onishi, Hisako Kanemoto, Chinatsu Akasaki, Nobuhiko Okamoto, Junichi Suwabe, Yuichi Nakamura, Jun Fukuyama",Japan,"October 1, 2020",2016,TV-MA,2 Seasons,"Anime Series, International TV Shows, Teen TV Shows",25,3,0.8928571428571429
"Good Morning, Verônica",TV Show,,"Tainá Müller, Eduardo Moscovis, Camila Morgado, Antonio Grassi, Elisa Volpatto, César Mello, Sílvio Guindane, Alice Valverde, DJ Amorim, Adriano Garib, Johnnas Oliva, Marina Provenzzano, José Rubens Chachá, Julia Ianina, Sacha Bali, Aline Borges, Cassio Pandolfi, Pally Siqueira, Juliana Lohmann",Brazil,"October 1, 2020",2020,TV-MA,1 Season,"Crime TV Shows, International TV Shows, TV Mysteries",20,3,0.8695652173913043
Journey of an African Colony,TV Show,,Olasupo Shasore,,"October 1, 2020",2018,TV-MA,1 Season,"Docuseries, International TV Shows",24,2,0.9230769230769231
Oktoberfest: Beer & Blood,TV Show,,"Mišel Matičević, Martina Gedeck, Klaus Steinbacher, Mercedes Müller, Maximilian Brückner, Brigitte Hobmeier, Markus Krojer, Martin Feifel, Michael Kranz, Vladimir Burlakov","Germany, Czech Republic","October 1, 2020",2020,TV-MA,1 Season,"International TV Shows, TV Dramas",22,2,0.9166666666666666
Secreto bien guardado,TV Show,,"Oriana Sabatini, Victorio D'Alessandro, Noemí Frenkel, Matías Mayer, Paula Sartor, Agustina Palma, Graciela Tenenbaum, Bárbara Lombardo",Argentina,"October 1, 2020",2019,TV-MA,1 Season,"International TV Shows, Romantic TV Shows, Spanish-Language TV Shows",19,3,0.8636363636363636
Sword Art Online,TV Show,,"Yoshitsugu Matsuoka, Haruka Tomatsu, Ayana Taketatsu, Kanae Ito, Rina Hidaka, Ayahi Takagaki, Hiroaki Hirata, Hiroki Yasumoto, Saori Hayami, Koichi Yamadera",Japan,"October 1, 2020",2018,TV-MA,3 Seasons,"Anime Series, International TV Shows",14,2,0.875
The Parkers,TV Show,,"Mo'Nique, Countess Vaughn, Dorien Wilson, Jenna von Oÿ, Ken Lawson, Yvette Wilson",United States,"October 1, 2020",2003,TV-PG,5 Seasons,TV Comedies,10,1,0.9090909090909091
The Unicorn,TV Show,,"Walton Goggins, Rob Corddry, Michaela Watkins, Omar Benson Miller, Maya Lynne Robinson, Ruby Jay, Makenzie Moss",United States,"October 1, 2020",2019,TV-14,1 Season,"TV Comedies, TV Dramas",10,2,0.8333333333333334
You Cannot Hide,TV Show,,"Blanca Soto, Eduardo Noriega, Iván Sánchez, Maribel Verdú, Samantha Siqueiros, Peter Vives, Patricia Guirado, Jorge Bosch, Pere Ponce, Juan Caballero, Jordi Planas",Mexico,"October 1, 2020",2020,TV-MA,1 Season,"Crime TV Shows, International TV Shows, Spanish-Language TV Shows",13,3,0.8125
Black Butler,TV Show,,"Daisuke Ono, Maaya Sakamoto, Hiroki Touchi, Yuki Kaji, Emiri Kato, Koji Yusa, Shunji Fujimura, Yukari Tamura, Romi Park, Jun Fukuyama",Japan,"September 30, 2020",2010,TV-MA,3 Seasons,"Anime Series, International TV Shows",11,2,0.8461538461538461
Man with a Plan,TV Show,,"Matt LeBlanc, Liza Snyder, Grace Kaufman, Matthew McCann, Hala Finley, Matt Cook, Jessica Chaffin",United States,"September 30, 2020",2020,TV-PG,4 Seasons,TV Comedies,12,1,0.9230769230769231
Wentworth,TV Show,,"Danielle Cormack, Nicole da Silva, Kate Atkinson, Celia Ireland, Shareena Clanton, Aaron Jeffery, Robbie Magasiva, Katrina Milosevic, Jacqueline Brennan, Ra Chapman, Pamela Rabe, Sigrid Thornton, Socratis Otto, Bernard Curry, Tammy MacIntosh, Kate Jenkinson",Australia,"September 30, 2020",2020,TV-MA,8 Seasons,"Crime TV Shows, TV Dramas",9,2,0.8181818181818182
"Whose Vote Counts, Explained",TV Show,,,United States,"September 28, 2020",2020,TV-PG,1 Season,Docuseries,25,1,0.9615384615384616
Van Helsing,TV Show,,"Kelly Overton, Jonathan Scarfe, Christopher Heyerdahl, Paul Johansson, David Cubitt, Tim Guinee",United States,"September 27, 2020",2019,TV-MA,4 Seasons,"International TV Shows, TV Action & Adventure, TV Dramas",10,3,0.7692307692307693
The Good Place,TV Show,,"Kristen Bell, Ted Danson, William Jackson Harper, Jameela Jamil, D'Arcy Carden, Manny Jacinto",United States,"September 26, 2020",2020,TV-14,4 Seasons,TV Comedies,12,1,0.9230769230769231
A Perfect Crime,TV Show,,,Germany,"September 25, 2020",2020,TV-14,1 Season,"Crime TV Shows, Docuseries, International TV Shows",13,3,0.8125
Mighty Little Bheem,TV Show,,,,"September 25, 2020",2020,TV-Y,3 Seasons,"Kids' TV, TV Comedies",17,2,0.8947368421052632
Sneakerheads,TV Show,,"Allen Maldonado, Andrew Bachelor, Jearnest Corchado, Matthew Josten, Yaani King Mondschein, Justin Lee, Aja Evans",United States,"September 25, 2020",2020,TV-MA,1 Season,TV Comedies,12,1,0.9230769230769231
The School Nurse Files,TV Show,,"Jung Yu-mi, Nam Joo-hyuk",South Korea,"September 25, 2020",2020,TV-MA,1 Season,"International TV Shows, TV Dramas, TV Mysteries",19,3,0.8636363636363636
The Chef Show,TV Show,,"Jon Favreau, Roy Choi",United States,"September 24, 2020",2020,TV-MA,4 Seasons,Docuseries,11,1,0.9166666666666666
The Playbook,TV Show,,,United States,"September 22, 2020",2020,TV-MA,1 Season,Docuseries,11,1,0.9166666666666666
Fukrey Boyzzz,TV Show,,"Viraaj Modgill, Jasleen Singh, Pooja Punjabi, Viswanathan Sridhar, Manish Bhavan, Suvela Sharma, Surabhi Pandey, Zeel Thakkar",,"September 19, 2020",2020,TV-Y,1 Season,"Kids' TV, TV Comedies",12,2,0.8571428571428571
Ratched,TV Show,,"Sarah Paulson, Finn Wittrock, Judy Davis, Sharon Stone, Cynthia Nixon, Jon Jon Briones, Charlie Carver",United States,"September 18, 2020",2020,TV-MA,1 Season,"TV Dramas, TV Horror, TV Mysteries",7,3,0.7
The American Barbecue Showdown,TV Show,,"Lyric Lewis, Rutledge Wood",United States,"September 18, 2020",2020,TV-G,1 Season,Reality TV,27,1,0.9642857142857143
The Blacklist,TV Show,,"James Spader, Megan Boone, Diego Klattenhoff, Ryan Eggold, Harry Lennix, Amir Arison, Hisham Tawfiq, Mozhan Marnò",United States,"September 18, 2020",2019,TV-14,7 Seasons,"Crime TV Shows, TV Dramas, TV Thrillers",12,3,0.8
Dragon's Dogma,TV Show,,"Greg Chun, Erica Mendez, Cristina Vee, David Lodge, Yuichi Nakamura, Nana Mizuki, Miyuki Sawashiro, Yuko Sanpei, Suzuko Mimori, Takayuki Sugo",,"September 17, 2020",2020,TV-MA,1 Season,"Anime Series, International TV Shows",13,2,0.8666666666666667
The Last Word,TV Show,,"Anke Engelke, Thorsten Merten, Nina Gummich, Johannes Zeiler, Juri Winkler, Gudrun Ritter, Aaron Hilmer, Claudia Geisler-Bading",Germany,"September 17, 2020",2020,TV-MA,1 Season,"International TV Shows, TV Comedies, TV Dramas",11,3,0.7857142857142857
Baby,TV Show,,"Benedetta Porcaroli, Alice Pagani, Riccardo Mandolini, Chabeli Sastre Gonzalez, Brando Pacitto, Lorenzo Zurzolo, Claudia Pandolfi, Galatea Ranzi",Italy,"September 16, 2020",2020,TV-MA,3 Seasons,"International TV Shows, TV Dramas, Teen TV Shows",4,3,0.5714285714285714
Challenger,TV Show,,,United States,"September 16, 2020",2020,TV-14,1 Season,"Docuseries, Science & Nature TV",10,2,0.8333333333333334
Criminal: UK,TV Show,,"Katherine Kelly, Lee Ingleby, Mark Stanley, Rochenda Sandall, Shubham Saraf, Nicholas Pinnock, David Tennant, Hayley Atwell, Youssef Kerkour, Clare-Hope Ashitey, Isabella Laughland","United Kingdom, France, Germany, Spain","September 16, 2020",2020,TV-MA,2 Seasons,"British TV Shows, Crime TV Shows, International TV Shows",11,3,0.7857142857142857
Signs,TV Show,,"Andrzej Konopka, Helena Sujecka, Piotr Trojan, Michał Czernecki, Mariusz Ostrowski, Robert Gulaczyk, Mirosław Kropielnicki, Helena Englert, Paulina Gałązka, Magdalena Źak",Poland,"September 16, 2020",2020,TV-MA,2 Seasons,"Crime TV Shows, International TV Shows, TV Dramas",5,3,0.625
Sing On!,TV Show,,Tituss Burgess,United States,"September 16, 2020",2020,TV-PG,1 Season,Reality TV,7,1,0.875
Call the Midwife,TV Show,Philippa Lowthorpe,"Vanessa Redgrave, Bryony Hannah, Helen George, Jenny Agutter, Pam Ferris, Laura Main, Judy Parfitt, Cliff Parisi, Stephen McGann, Ben Caplan, Miranda Hart, Jessica Raine, Max Macmillan, Victoria Yeates, Jack Ashton, Emerald Fennell, Linda Bassett",United Kingdom,"September 15, 2020",2020,TV-MA,9 Seasons,"British TV Shows, International TV Shows, TV Dramas",14,3,0.8235294117647058
Taco Chronicles,TV Show,,,United States,"September 15, 2020",2020,TV-MA,2 Seasons,"Docuseries, International TV Shows, Reality TV",14,3,0.8235294117647058
Buddi,TV Show,,"Greta Jameson, Ralf Jameson, Clementine Laikin, Felix Laikin","United Kingdom, China","September 11, 2020",2020,TV-Y,2 Seasons,"British TV Shows, Kids' TV",5,2,0.7142857142857143
Family Business,TV Show,,"Jonathan Cohen, Gérard Darmon, Julia Piaton, Liliane Rovère, Olivier Rosemberg, Ali Marhyar, Lina El Arabi, Louise Coldefy, Enrico Macias, Valérie Damidot",France,"September 11, 2020",2020,TV-MA,2 Seasons,"International TV Shows, TV Comedies, TV Dramas",14,3,0.8235294117647058
Girlfriends,TV Show,,"Tracee Ellis Ross, Golden Brooks, Persia White, Jill Marie Jones, Reginald C. Hayes",United States,"September 11, 2020",2007,TV-14,8 Seasons,TV Comedies,11,1,0.9166666666666666
The Barrier,TV Show,,"Unax Ugalde, Olivia Molina, Eleonora Wexler, Abel Folk, Ángela Molina, Manu Fullola, Daniel Ibáñez, Laura Quirós, Nicolás Illoro, Belén Écija, Juan Blanco, Yaima Ramos",Spain,"September 11, 2020",2020,TV-MA,1 Season,"International TV Shows, Spanish-Language TV Shows, TV Dramas",10,3,0.7692307692307693
The Duchess,TV Show,,"Katherine Ryan, Rory Keenan, Katy Byrne, Doon Mackichan, Steen Raskopoulos, Michelle de Swarte, Sophie Fletcher",United Kingdom,"September 11, 2020",2020,TV-MA,1 Season,"British TV Shows, International TV Shows, TV Comedies",10,3,0.7692307692307693
Greenleaf,TV Show,,"Merle Dandridge, Kim Hawthorne, Desiree Ross, Lamman Rucker, Tye White, Lynn Whitfield, Deborah Joy Winans, Keith David, Lovie Simone, Gregory Alan Williams, Oprah Winfrey",United States,"September 10, 2020",2020,TV-14,5 Seasons,TV Dramas,9,1,0.9
Julie and the Phantoms,TV Show,Kenny Ortega,"Madison Reyes, Charlie Gillespie, Owen Patrick Joyner, Jeremy Shada, Jadah Marie, Sacha Carlson, Savannah Lee May, Cheyenne Jackson, Carlos Ponce, Booboo Stewart, Sonny Bustamante",United States,"September 10, 2020",2020,TV-G,1 Season,"Kids' TV, TV Comedies",19,2,0.9047619047619048
Get Organized with The Home Edit,TV Show,,,United States,"September 9, 2020",2020,TV-PG,1 Season,Reality TV,27,1,0.9642857142857143
La Línea: Shadow of Narco,TV Show,Pepe Mora,,Spain,"September 9, 2020",2020,TV-MA,1 Season,"Crime TV Shows, Docuseries, International TV Shows",21,3,0.875
Record of Youth,TV Show,,"Park Bo-gum, Park So-dam, Byeon Woo-seok, Ha Hee-ra, Shin Ae-ra, Han Jin-hee, Shin Dong-mi, Lee Chang-hoon, Kwon Soo-hyun, Cho Yu-jung, Park Su-young, Seo Sang-won, Lee Jae-won",South Korea,"September 8, 2020",2020,TV-14,1 Season,"International TV Shows, Romantic TV Shows, TV Dramas",13,3,0.8125
Transformers: Cyberverse,TV Show,,"Sophia Isabella, Jeremy Levy, Jacob Tillman, Ryan Andes, Deanna McGovern, Dick Terhune",,"September 7, 2020",2020,TV-Y7,2 Seasons,Kids' TV,23,1,0.9583333333333334
Cleverman,TV Show,,"Hunter Page-Lochard, Rob Collins, Deborah Mailman, Ryan Corr, Stef Dawson, Iain Glen, Frances O'Connor, Tasma Walton, Tony Briggs","Australia, New Zealand, United States","September 5, 2020",2017,TV-MA,1 Season,"TV Dramas, TV Sci-Fi & Fantasy, TV Thrillers",9,3,0.75
Away,TV Show,,"Hilary Swank, Josh Charles, Vivian Wu, Mark Ivanir, Ato Essandoh, Ray Panthaki, Talitha Eliana Bateman",United States,"September 4, 2020",2020,TV-14,1 Season,"Romantic TV Shows, TV Dramas, TV Sci-Fi & Fantasy",4,3,0.5714285714285714
