title,type,director,cast,country,date_added,release_year,rating,duration,listed_in,title_length,genres_count,score
Misaeng,TV Show,,"Im Si-wan, Kang So-ra, Lee Sung-min, Kang Ha-neul, Byun Yo-han, Kim Dae-myeong, Shin Eun-jung, Park Hae-joon",South Korea,"August 8, 2019",2014,TV-MA,1 Season,"International TV Shows, Korean TV Shows, TV Dramas",7,3,0.7
Oh My Ghost,TV Show,,"Park Bo-young, Cho Jung-seok, Lim Ju-hwan, Kim Seul-ki",South Korea,"August 8, 2019",2015,TV-MA,1 Season,"International TV Shows, Korean TV Shows, Romantic TV Shows",9,3,0.75
Reply 1994,TV Show,Shin Won-ho,"Go Ara, Jung Woo, Sung Dong-il, Dohee, Son Ho-jun, Kim Sung-kyun, Cha Seon-wu, Yoo Yeon-seok, Lee Il-hwa",South Korea,"August 8, 2019",2014,TV-MA,1 Season,"International TV Shows, Korean TV Shows, Romantic TV Shows",9,3,0.75
Reply 1997,TV Show,Shin Won-ho,"Jung Eun-ji, Seo In-guk, Shin So-yul, Ji-won Eun, Lee Ho-won, Lee Si-eon, Sung Dong-il, Lee Il-hwa, Song Jong-ho",South Korea,"August 8, 2019",2012,TV-MA,1 Season,"International TV Shows, Korean TV Shows, Romantic TV Shows",9,3,0.75
Wu Assassins,TV Show,,"Iko Uwais, Katheryn Winnick, Byron Mann, Tommy Flanagan, Li Jun Li, Celia Au, Lewis Tan, Lawrence Kao, Juju Chan, Tzi Ma, Cranston Johnson, Mark Dacascos, Kevin Durand, Jeff Fahey, Summer Glau",United States,"August 8, 2019",2019,TV-MA,1 Season,"TV Action & Adventure, TV Sci-Fi & Fantasy",11,2,0.8461538461538461
No Good Nick,TV Show,,"Melissa Joan Hart, Sean Astin, Siena Agudong, Lauren Lindsey Donzis, Kalama Epstein",United States,"August 5, 2019",2019,TV-PG,2 Seasons,"Kids' TV, TV Comedies, TV Dramas",10,3,0.7692307692307693
Basketball or Nothing,TV Show,,,United States,"August 2, 2019",2019,TV-PG,1 Season,"Docuseries, Reality TV",19,2,0.9047619047619048
Sleepless Society: Nyctophobia,TV Show,,"Chermarn Boonyasak, Nattapat Nimjirawat, Jason Young, Matthew Deane Chanthavanij, Inthira Charoenpura, Natharinee Kanasoot",Thailand,"August 1, 2019",2019,TV-MA,1 Season,"International TV Shows, TV Mysteries, TV Thrillers",28,3,0.9032258064516129
The Letdown,TV Show,,"Alison Bell, Duncan Fellows, Noni Hazlehurst, Sacha Horler, Leon Ford, Lucy Durack, Leah Vandenberg, Celeste Barber, Xana Tang, Patrick Brammall",Australia,"July 31, 2019",2019,TV-MA,2 Seasons,"International TV Shows, TV Comedies, TV Dramas",10,3,0.7692307692307693
Twelve Forever,TV Show,,"Kelsy Abbott, Antony Del Rio, Jaylen Barron, Matt Berry, Bridget Everett, Brandon Wardell, Steve Agee, Spencer Rothbell, Nick Sumida, Ashley Boettcher, Wade Randolph",United States,"July 29, 2019",2019,TV-PG,1 Season,Kids' TV,13,1,0.9285714285714286
My First First Love,TV Show,,"Ji Soo, Jung Chae-yeon, Jinyoung, Choi Ri, Kang Tae-oh, Hong Ji-yoon",South Korea,"July 26, 2019",2019,TV-14,2 Seasons,"International TV Shows, Korean TV Shows, Romantic TV Shows",16,3,0.8421052631578947
Another Life,TV Show,,"Katee Sackhoff, Justin Chatwin, Samuel Anderson, Blu Hunt, AJ Rivera, Jake Abel, Alex Ozerov, Alexander Eling, Lina Renna, Selma Blair",United States,"July 25, 2019",2019,TV-MA,1 Season,"British TV Shows, International TV Shows, TV Action & Adventure",11,3,0.7857142857142857
Beat Bugs,TV Show,,"Ashleigh Ball, Lili Beaudoin, Charles Demers, Rebecca Husain, Erin Mathews","Australia, Canada","July 21, 2019",2018,TV-Y,3 Seasons,Kids' TV,8,1,0.8888888888888888
Sexy Central,TV Show,,"Jeana Ho Pui-yu, Joyce Cheng, Ava Liu, Shiga Lin, Kelly Chen Jia-li, Eric Suen Yiu-wai, Eric Kwok, Mix, Adam Pak, Patrick Tang",Hong Kong,"July 20, 2019",2019,TV-MA,1 Season,"International TV Shows, Romantic TV Shows, TV Dramas",11,3,0.7857142857142857
Comedians in Cars Getting Coffee,TV Show,Jerry Seinfeld,Jerry Seinfeld,United States,"July 19, 2019",2019,TV-14,6 Seasons,"Stand-Up Comedy & Talk Shows, TV Comedies",28,2,0.9333333333333333
The Epic Tales of Captain Underpants,TV Show,,"Nat Faxon, Jay Gragnani, Ramone Hamilton, Sean Astin, Dayci Brookshire, Jorge Diaz, Evan Kishiyama",United States,"July 19, 2019",2019,TV-Y7,3 Seasons,"Kids' TV, TV Comedies",31,2,0.9393939393939394
Typewriter,TV Show,,"Aarna Sharma, Aaryansh Malviya, Mikail Gandhi, Palash Kamble, Jishu Sengupta, Palomi Ghosh, Purab Kohli, Sameer Kochhar, Sara Gesawat",India,"July 19, 2019",2019,TV-MA,1 Season,"International TV Shows, TV Horror, TV Mysteries",10,3,0.7692307692307693
Rookie Historian Goo Hae-Ryung,TV Show,,"Shin Sae-kyeong, Cha Eun-woo, Park Ki-woong, Lee Ji-hoon, Park Ji-hyun, Gong Jung-hwan, Kim Min-sang, Choi Duk-mun, Kim Yeo-jin",South Korea,"July 18, 2019",2019,TV-14,1 Season,"International TV Shows, Korean TV Shows, Romantic TV Shows",27,3,0.9
Pinky Malinky,TV Show,,"Lucas Grabeel, Nathan Kress, Diamond White, Danny Jacobs, Retta, Colleen Smith, Vargus Mason, Lauren Tom, Robbie Daymond, Grey Griffin",United States,"July 17, 2019",2019,TV-Y7,3 Seasons,"Kids' TV, TV Comedies",12,2,0.8571428571428571
Unrequited Love,TV Show,,"Zhu Yanmanzi, Zhao Shunran, Shen Yu, Zhang Yichi, Mengqin, Esther Chen, Zhang Zhehao, He Meixuan, Yuan Baizihui",China,"July 17, 2019",2019,TV-14,1 Season,"International TV Shows, Romantic TV Shows, TV Dramas",14,3,0.8235294117647058
Angel Beats!,TV Show,,"Hiroshi Kamiya, Harumi Sakurai, Kana Hanazawa, Eri Kitamura, Ryohei Kimura, Takahiro Mizushima, Shun Takagi, Fuko Saito, Yui Makino, Hiro Masuda, Michael Rivas, Eiichiro Tokumoto, Yumiko Kobayashi, Hiroki Touchi, Miyuki Sawashiro, Chie Matsuura, Kana Asumi, Emiri Kato",Japan,"July 15, 2019",2010,TV-PG,1 Season,"Anime Series, International TV Shows",11,2,0.8461538461538461
Anohana: The Flower We Saw That Day,TV Show,,"Miyu Irino, Ai Kayano, Haruka Tomatsu, Takahiro Sakurai, Saori Hayami, Takayuki Kondo, Mitsuru Ogata, Mutsumi Tamura, Asami Seto, Aki Toyosaki, Kaoru Mizuhara, Yui Makino",Japan,"July 15, 2019",2011,TV-14,1 Season,"Anime Series, International TV Shows, Teen TV Shows",29,3,0.90625
God Eater,TV Show,,"Ryuichi Kijima, Hiroaki Hirata, Kazuya Nakai, Sayaka Ohara, Daisuke Sakaguchi, Maaya Sakamoto",Japan,"July 15, 2019",2015,TV-14,1 Season,"Anime Series, International TV Shows",8,2,0.8
GRANBLUE FANTASY the Animation,TV Show,,"Yuki Ono, Nao Toyama, Rie Kugimiya, Miyuki Sawashiro, Hiroaki Hirata, Yukari Tamura, Kazuhiro Yamaji, Rie Tanaka, Emiri Kato, Tomokazu Sugita, Kanae Ito",Japan,"July 15, 2019",2017,TV-PG,1 Season,"Anime Series, International TV Shows",27,2,0.9310344827586207
3Below: Tales of Arcadia,TV Show,,"Tatiana Maslany, Diego Luna, Nick Offerman, Nick Frost, Glenn Close, Alon Aboutboul, Hayley Atwell, Darin De Paul, Andy Garcia, Cheryl Hines, Tom Kenny, Chris Obi, Cole Sand, Frank Welker, Steven Yeun",United States,"July 12, 2019",2019,TV-Y7,2 Seasons,"Kids' TV, TV Action & Adventure, TV Sci-Fi & Fantasy",21,3,0.875
Bonus Family,TV Show,,"Vera Vitali, Erik Johansson, Fredrik Hallgren, Petra Mede, Frank Dorsin, Jacob Lundqvist, Amanda Lindh, Marianne Mörck, Barbro Svensson, Ann Petrén, Johan Ulveson, Leo Razzak, Felix Engström",Sweden,"July 12, 2019",2019,TV-MA,3 Seasons,"International TV Shows, TV Dramas",11,2,0.8461538461538461
Extreme Engagement,TV Show,,"Tim Noonan, PJ Madam",,"July 12, 2019",2019,TV-MA,1 Season,"International TV Shows, Reality TV",17,2,0.8947368421052632
One Spring Night,TV Show,,"Han Ji-min, Jung Hae-in, Kim Jun-han, Yim Sung-eon, Song Seung-hwan, Kil Hae-yeon, Lee Moo-saeng, Kim Chang-wan",South Korea,"July 12, 2019",2019,TV-14,1 Season,"International TV Shows, Korean TV Shows, Romantic TV Shows",14,3,0.8235294117647058
PILI Fantasy: War of Dragons,TV Show,,"Wang Hsi-hua, Lai Wei, Zhang Yu-quan, Chen Yu-kuan, Gao Ming-xiao, Tian Zhi-jie, Li Xiang-yu, Guo Ya-zhen, Zhan Yi-chun, Ye Yu-jia",,"July 12, 2019",2019,TV-14,1 Season,"International TV Shows, TV Action & Adventure, TV Sci-Fi & Fantasy",24,3,0.8888888888888888
True Tunes,TV Show,,"Michela Luci, Jamie Watson, Eric Peterson, Anna Claire Bartlam, Nicolas Aqui, Cory Doran, Julie Lemieux",,"July 12, 2019",2019,TV-Y,1 Season,Kids' TV,9,1,0.9
Free Rein,TV Show,,"Jaylen Barron, Manpreet Bambra, Celine Buckens, Freddy Carter, Caroline Ford, Natalie Gumede, Bruce Herbelin-Earle, Noah Huntley, Kerry Ingram, Paul Luebke, Geoffrey McGivern, Navia Ziraili Robinson, Milo Twomey, Carla Woodcock",United States,"July 6, 2019",2019,TV-G,3 Seasons,"British TV Shows, Kids' TV, TV Dramas",8,3,0.7272727272727273
The Legend of White Snake,TV Show,,"Yu Menglong, Ju Jingyi, Pei Zitian, Xiao Yan, Nie Zihao, Yu Lang",China,"July 5, 2019",2019,TV-14,1 Season,"International TV Shows, Romantic TV Shows, TV Dramas",21,3,0.875
Kakegurui,TV Show,,"Minami Hamabe, Mahiro Takasugi, Aoi Morikawa",,"July 4, 2019",2019,TV-MA,2 Seasons,"International TV Shows, TV Dramas, TV Thrillers",9,3,0.75
Stranger Things,TV Show,,"Winona Ryder, David Harbour, Finn Wolfhard, Millie Bobby Brown, Gaten Matarazzo, Caleb McLaughlin, Natalia Dyer, Charlie Heaton, Cara Buono, Noah Schnapp, Matthew Modine, Joe Keery, Dacre Montgomery, Sadie Sink, Paul Reiser, Sean Astin",United States,"July 4, 2019",2019,TV-14,3 Seasons,"TV Horror, TV Mysteries, TV Sci-Fi & Fantasy",14,3,0.8235294117647058
The Last Czars,TV Show,,"Robert Jack, Susanna Herbert, Ben Cartwright, Oliver Dimsdale, Gavin Mitchell, Elsie Bennett, Bernice Stegers",United States,"July 3, 2019",2019,TV-MA,1 Season,"Docuseries, TV Dramas",12,2,0.8571428571428571
Yummy Mummies,TV Show,,"Lorinska Merrington, Jane Scandizzo, Rachel Watts, Maria DiGeronimo",Australia,"July 3, 2019",2019,TV-MA,2 Seasons,"International TV Shows, Reality TV",12,2,0.8571428571428571
Bangkok Love Stories: Objects of Affection,TV Show,,"Apinya Sakuljaroensuk, Kanokchat Munyadon, Gyeon Seo, Nalin Hohler, Thongpoom Siripipat, Chinawut Indracusin, Preeyada Sitthachai, Akarin Akaranitimaytharatt, Adul Charoenrasameekiat, Kanlaya Lertkasemsup",Thailand,"July 2, 2019",2019,TV-14,1 Season,"International TV Shows, Romantic TV Shows, TV Dramas",37,3,0.925
Bangkok Love Stories: Plead,TV Show,,"Chanon Santinatornkul, Sutatta Udomsilp, Morakot Liu, Varot Makaduangkeo, Sutthatip Wutichaipradit, Cholsawas Tiewwanichkul, Surapol Poonpiriya, Hattaya Wongkrachang",Thailand,"July 2, 2019",2019,TV-14,1 Season,"International TV Shows, Romantic TV Shows, TV Dramas",24,3,0.8888888888888888
Designated Survivor: 60 Days,TV Show,,"Ji Jin-hee, Lee Jun-hyuk, Heo Jun-ho, Kang Han-na, Bae Jong-ok, Kim Gyu-ri, Son Suk-ku, Choi Yoon-young, Lee Moo-saeng",South Korea,"July 2, 2019",2019,TV-14,1 Season,"International TV Shows, Korean TV Shows, TV Dramas",25,3,0.8928571428571429
DreamWorks Kung Fu Panda Awesome Secrets,TV Show,,"Jack Black, Dustin Hoffman, Dennis Haysbert, Paul Scheer, Randall Duk Kim, David Cross, Jessica DiCicco, Jaycee Chan, Angelina Jolie, Seth Rogen, Tony Leondis",United States,"July 1, 2019",2008,TV-PG,1 Season,"Kids' TV, TV Action & Adventure, TV Comedies",35,3,0.9210526315789473
Hatchimals | Adventures in Hatchtopia,TV Show,,"Sam Vincent, Kira Tozer, Andrea Libman",United States,"July 1, 2019",2018,TV-Y,2 Seasons,Kids' TV,33,1,0.9705882352941176
Molang,TV Show,,Bruno Guéraçague,France,"July 1, 2019",2015,TV-Y,1 Season,Kids' TV,6,1,0.8571428571428571
Rabbids Invasion,TV Show,,"Damien Laquet, David Gasman, Barbara Scaff",France,"July 1, 2019",2018,TV-Y7,1 Season,"Kids' TV, TV Comedies",15,2,0.8823529411764706
Record of Grancrest War,TV Show,,"Kentaro Kumagai, Akari Kito, Yuichi Nakamura, Reina Ueda, Satoshi Hino, Yoshitsugu Matsuoka, Natsumi Takamori, Ai Kayano, Takahiro Sakurai, Wataru Hatano, Yuichi Iguchi, Minori Suzuki, Megumi Nakajima, Yuhko Kaida, Chika Anzai, Yumi Uchiyama, Kaede Hondo, Satoshi Mikami, Ayane Sakura, Ari Ozawa, Tatsuhisa Suzuki, Hiro Shimono",Japan,"July 1, 2019",2018,TV-MA,1 Season,"Anime Series, International TV Shows",20,2,0.9090909090909091
Scare Tactics,TV Show,,"Tracy Morgan, Lauren Ash",United States,"June 30, 2019",2011,TV-MA,2 Seasons,"Reality TV, TV Comedies, TV Horror",12,3,0.8
Dope,TV Show,,,United States,"June 28, 2019",2019,TV-MA,3 Seasons,"Crime TV Shows, Docuseries",4,2,0.6666666666666666
Exhibit A,TV Show,,,United States,"June 28, 2019",2019,TV-MA,1 Season,"Crime TV Shows, Docuseries, Science & Nature TV",8,3,0.7272727272727273
Instant Hotel,TV Show,,"Luke Jacobz, Juliet Ashworth",Australia,"June 28, 2019",2019,TV-MA,2 Seasons,"International TV Shows, Reality TV",12,2,0.8571428571428571
Motown Magic,TV Show,,,"Australia, United States","June 28, 2019",2019,TV-Y,2 Seasons,"Kids' TV, TV Sci-Fi & Fantasy",11,2,0.8461538461538461
Paquita Salas,TV Show,,"Brays Efe, Belén Cuesta, Lidia San José, Álex de Lucas, Mariona Terés",Spain,"June 28, 2019",2018,TV-MA,3 Seasons,"International TV Shows, Spanish-Language TV Shows, TV Comedies",12,3,0.8
Answer for Heaven,TV Show,,"Sunny Suwanmethanont, Kan Kantathavorn, Pattarasaya Kreuasuwansri, Chayanan Manomaisantiphap, Suwaphat Techaviriyawong, Prachakorn Piyasakulkaew, Nattarika Thampridanant, Michael Shaowanasai, Pattanachai Adirek",,"June 27, 2019",2019,TV-MA,1 Season,"Crime TV Shows, International TV Shows, TV Comedies",15,3,0.8333333333333334
Forest of Piano,TV Show,,"Soma Saito, Junichi Suwabe, Natsuki Hanae, Yuichi Nakamura, Kenn, Aoi Yuki, Mariya Ise, Katsuyuki Konishi, Toshiyuki Toyonaga, Koji Yusa, Hiroshi Yanaka, Ryoko Shiraishi, Yo Taichi, Marie Miyake, Ryo Hirohashi, Motoko Kumai, Maaya Sakamoto, Hideyuki Tanaka, Bin Shimada",Japan,"June 24, 2019",2019,TV-14,2 Seasons,"Anime Series, International TV Shows",13,2,0.8666666666666667
Bolívar,TV Show,"Luis Alberto Restrepo, Andrés Beltrán, Jaime Rayo","Luis Gerónimo Abreu, José Ramón Barreto, Ernesto Benjumea, Félix Antequera, Jefferson Quiñones, Shany Nadan, María José Vargas, Hans Martínez, Mauro Mauad, Álvaro Bayona, Rosmeri Marval, Irene Esser, Nohely Arteaga",Colombia,"June 21, 2019",2019,TV-MA,1 Season,"International TV Shows, Romantic TV Shows, Spanish-Language TV Shows",7,3,0.7
Girls Incarcerated,TV Show,,,United States,"June 21, 2019",2019,TV-MA,2 Seasons,"Docuseries, Reality TV",17,2,0.8947368421052632
Go! Live Your Way,TV Show,,"Pilar Pascual, Renata Toscano, José Giménez Zapiola, Santiago Saez, Paulo Sanchez Lima, Carmela Barsamian, Axel Muñiz, Majo Cardoso, Majo Chicar, Gastón Ricaud, Laura Azcurra",Argentina,"June 21, 2019",2019,TV-PG,2 Seasons,"Kids' TV, Spanish-Language TV Shows, Teen TV Shows",14,3,0.8235294117647058
Magi: The Labyrinth of Magic,TV Show,,"Kaori Ishihara, Yuki Kaji, Haruka Tomatsu, Daisuke Ono, Ryohei Kimura, Yoshimasa Hosoya, Takahiro Sakurai, Showtaro Morikubo, Yui Horie, Tomokazu Sugita",Japan,"June 21, 2019",2013,TV-MA,2 Seasons,"Anime Series, International TV Shows",24,2,0.9230769230769231
Neon Genesis Evangelion,TV Show,,"Megumi Ogata, Kotono Mitsuishi, Yuriko Yamaguchi, Megumi Hayashibara, Yuko Miyamura, Fumihiko Tachiki, Akira Ishida, Motomu Kiyokawa, Hiro Yuki, Miki Nagasawa, Takehito Koyasu, Tomokazu Seki, Tetsuya Iwanaga, Junko Iwao, Mugihito",Japan,"June 21, 2019",1995,TV-MA,1 Season,"Anime Series, International TV Shows",21,2,0.9130434782608695
Shooter,TV Show,,"Ryan Phillippe, Omar Epps, David Marciano, Cynthia Addai-Robinson, Shantel VanSanten, Tom Sizemore",United States,"June 21, 2019",2018,TV-14,3 Seasons,"Crime TV Shows, TV Action & Adventure, TV Dramas",7,3,0.7
The Casketeers,TV Show,,,New Zealand,"June 21, 2019",2019,TV-14,2 Seasons,"International TV Shows, Reality TV",13,2,0.8666666666666667
The Confession Tapes,TV Show,,,United States,"June 21, 2019",2019,TV-MA,2 Seasons,"Crime TV Shows, Docuseries",18,2,0.9
Fate/Zero,TV Show,,"Rikiya Koyama, Ayako Kawasumi, Sayaka Ohara, Sho Hayami, Tomokazu Seki, Jouji Nakata, Akina Abe, Takumi Yamasaki, Hikaru Midorikawa, Daisuke Namikawa",Japan,"June 15, 2019",2012,TV-MA,2 Seasons,"Anime Series, International TV Shows",9,2,0.8181818181818182
Kill la Kill,TV Show,,"Ami Koshimizu, Toshihiko Seki, Ryoka Yuzuki, Aya Suzaki, Shinichiro Miki, Tetsu Inada, Nobuyuki Hiyama, Mayumi Shintani, Hiroyuki Yoshino, Romi Park",Japan,"June 15, 2019",2014,TV-MA,1 Season,"Anime Series, International TV Shows",10,2,0.8333333333333334
Puella Magi Madoka Magica,TV Show,,"Aoi Yuki, Chiwa Saito, Kaori Mizuhashi, Eri Kitamura, Emiri Kato, Ai Nonaka",Japan,"June 15, 2019",2011,TV-14,1 Season,"Anime Series, International TV Shows",22,2,0.9166666666666666
Somewhere Only We Know,TV Show,,"Zhang Chao, Li Tingting, Chen Bohao, Sun Jialing, Zhang Zhang, Li Jiuxiao, Deng Yuli, Li Huan, Fang Wenqiang, Gong Rui",China,"June 15, 2019",2019,TV-MA,1 Season,"International TV Shows, Romantic TV Shows, TV Comedies",19,3,0.8636363636363636
The Alcàsser Murders,TV Show,Elías León,,Spain,"June 15, 2019",2019,TV-MA,1 Season,"Crime TV Shows, Docuseries, International TV Shows",18,3,0.8571428571428571
Unit 42,TV Show,,"Patrick Ridremont, Constance Gay, Tom Audenaert, Roda Fawaz, Danitza Athanassiadis",Belgium,"June 15, 2019",2017,TV-MA,1 Season,"Crime TV Shows, International TV Shows, TV Dramas",6,3,0.6666666666666666
Awake: The Million Dollar Game,TV Show,,James Davis,United States,"June 14, 2019",2019,TV-PG,1 Season,Reality TV,26,1,0.9629629629629629
Black Spot,TV Show,,"Suliane Brahim, Hubert Delattre, Laurent Capelluto, Samuel Jouy, Renaud Rutten, Camille Aguilar, Tiphaine Daviot, Naidra Ayadi, Brigitte Sy, Anne Suarez, Dan Herzberg, Olivier Bonjour, Thomas Doret","France, Belgium","June 14, 2019",2019,TV-MA,2 Seasons,"Crime TV Shows, International TV Shows, TV Dramas",9,3,0.75
El desconocido,TV Show,,"Guillermo Iván, César Manjarrez, Estrella Solís, Liliana Moreno, Marco Uriel, Mario Zaragoza, Fernando Sarfatti, José Ángel Bichir, Paty Blanco, Pía Sanz, Scarlet Gruber, Pakey Vázquez, Ivonne Montero",,"June 14, 2019",2019,TV-MA,2 Seasons,"Crime TV Shows, International TV Shows, Spanish-Language TV Shows",13,3,0.8125
Girlfriends' Guide to Divorce,TV Show,,"Lisa Edelstein, Beau Garrett, Necar Zadegan, Paul Adelstein, Janeane Garofalo, Alanna Ubach",United States,"June 14, 2019",2019,TV-MA,5 Seasons,"TV Comedies, TV Dramas",26,2,0.9285714285714286
Leila,TV Show,,"Huma Qureshi, Siddharth, Rahul Khanna, Arif Zakaria, Seema Biswas, Sanjay Suri, Akash Khurana, Ashwath Bhatt, Anupam Bhattacharya, Adarsh Gourav",India,"June 14, 2019",2019,TV-MA,1 Season,"British TV Shows, International TV Shows, TV Dramas",5,3,0.625
Marlon,TV Show,,"Marlon Wayans, Essence Atkins, Bresha Webb, Diallo Riddle, Notlim Taylor, Amir O'Neil",United States,"June 14, 2019",2018,TV-14,2 Seasons,TV Comedies,6,1,0.8571428571428571
Marvel's Jessica Jones,TV Show,,"Krysten Ritter, David Tennant, Rachael Taylor, Mike Colter, Carrie-Anne Moss, Eka Darville, Erin Moriarty, Wil Traval, Susie Abromeit",United States,"June 14, 2019",2019,TV-MA,3 Seasons,"Crime TV Shows, TV Action & Adventure, TV Dramas",20,3,0.8695652173913043
Yankee,TV Show,,"Pablo Lyle, Ana Layevska, Leonardo Daniel, Javier Díaz Dueñas, Daniel Martínez, Pamela Almanza, Roberto Blandón, Sebastián Ferrat, Gabriela Zamora, Mauricio Pimentel, Julio Casado, Eivaut Rischen",Mexico,"June 14, 2019",2019,TV-MA,1 Season,"Crime TV Shows, International TV Shows, Spanish-Language TV Shows",6,3,0.6666666666666666
Jinn,TV Show,,"Salma Malhas, Sultan Alkhail, Hamzeh Okab, Aysha Shahaltough, Zaid Zoubi, Ban Halaweh, Yasser Al Hadi",Jordan,"June 13, 2019",2019,TV-MA,1 Season,"International TV Shows, TV Dramas, TV Mysteries",4,3,0.5714285714285714
Upin & Ipin,TV Show,,Nurfathiah Diaz,Malaysia,"June 10, 2019",2011,TV-Y,1 Season,Kids' TV,9,1,0.9
Designated Survivor,TV Show,,"Kiefer Sutherland, Natascha McElhone, Maggie Q, Kal Penn, Adan Canto, Italia Ricci, LaMonica Garrett, Tanner Buchanan, Ben Lawson, Paulo Costanzo, Zoe McLellan",United States,"June 7, 2019",2019,TV-MA,3 Seasons,"Crime TV Shows, TV Dramas, TV Thrillers",18,3,0.8571428571428571
Super Monsters Monster Pets,TV Show,,"Erin Mathews, Kathleen Barr, Chiara Zanni, Rebecca Shoichet, Sabrina Pitre, Ingrid Nilson, Alessandro Juliani, Elyse Maloway, Vincent Tong",United States,"June 7, 2019",2019,TV-Y,1 Season,Kids' TV,24,1,0.96
Tales of the City,TV Show,,"Laura Linney, Ellen Page, Olympia Dukakis, Paul Gross, Murray Bartlett, Barbara Garrick, Charlie Barnett, Garcia, May Hong, Jen Richards, Victor Garber, Ashley Park, Christopher Larkin, Zosia Mamet, Molly Ringwald, Daniela Vega",United States,"June 7, 2019",2019,TV-MA,1 Season,TV Dramas,14,1,0.9333333333333333
Black Mirror,TV Show,,"Jesse Plemons, Cristin Milioti, Jimmi Simpson, Rosemarie DeWitt, Douglas Hodge, Andrea Riseborough, Brenna Harding, Owen Teague, Andrew Gower, Kiran Sonia Sawar, Georgina Campbell, Joe Cole, Maxine Peake, Jake Davies, Clint Dyer, Letitia Wright, Babs Olusanmokun, Bryce Dallas Howard, Alice Eve, Michael Kelly, Cherry Jones, Gugu Mbatha-Raw, Mackenzie Davis, Wyatt Russell, Benedict Wong, Kelly Macdonald, Faye Marsay, Madeline Brewer, Hannah John-Kamen, Malachi Kirby, Alex Lawther, Jerome Flynn, James Norton, Rory Kinnear, Lindsay Duncan, Daniel Kaluuya, Jessica Brown Findlay, Rupert Everett, Toby Kebbell, Jodie Whittaker, Hayley Atwell, Domhnall Gleeson, Lenora Crichlow, Michael Smiley, Daniel Rigby, Chloe Pirrie, Jason Flemyng, Jon Hamm, Oona Chaplin, Rafe Spall",United Kingdom,"June 5, 2019",2019,TV-MA,5 Seasons,"British TV Shows, International TV Shows, TV Dramas",11,3,0.7857142857142857
Documentary Now!,TV Show,,"Fred Armisen, Bill Hader, Helen Mirren",United States,"June 3, 2019",2019,TV-14,3 Seasons,TV Comedies,15,1,0.9375
Malibu Rescue: The Series,TV Show,,"Ricardo Hurtado, Breanna Yde, Jackie R. Jacobson, Abby Donnelly, Alkoya Brunson, Jeremy Howard, JT Neal, Bryana Salaz, Ian Ziering, Camaron Engels",United States,"June 3, 2019",2019,TV-G,1 Season,"Kids' TV, TV Action & Adventure, TV Comedies",22,3,0.88
Arthdal Chronicles,TV Show,,"Song Joong-ki, Jang Dong-gun, Kim Ji-won, Kim Ok-vin, Kim Eui-sung, Cho Seong-ha, Lee Do-gyeong, Park Hae-joon, Park Byung-eun",South Korea,"June 2, 2019",2019,TV-MA,1 Season,"International TV Shows, Korean TV Shows, TV Action & Adventure",17,3,0.85
A Thousand Goodnights,TV Show,,"Cindy Lien, Nicholas Teo, Yao Ai-ning, Li Chung-lin, Chen Bor-jeng, Miao Ke-li",Taiwan,"June 1, 2019",2019,TV-14,1 Season,"International TV Shows, TV Dramas",19,2,0.9047619047619048
March Comes in Like a Lion,TV Show,,"Kengo Kawanishi, Ai Kayano, Kana Hanazawa, Misaki Kuno, Nobuhiko Okamoto, Marina Inoue, Yoshimasa Hosoya, Shinichiro Miki, Tomokazu Sugita, Subaru Kimura, Shigeru Chiba, Toru Okawa, Takahiro Sakurai",Japan,"June 1, 2019",2017,TV-14,2 Seasons,"Anime Series, International TV Shows, Teen TV Shows",21,3,0.875
Bad Blood,TV Show,,"Anthony LaPaglia, Kim Coates, Enrico Colantoni, Paul Sorvino, Maxim Roy, Brett Donahue, Michelle Mylett, Claudia Ferri, Tony Nappo",Canada,"May 31, 2019",2019,TV-MA,2 Seasons,"Crime TV Shows, TV Dramas",8,2,0.8
Killer Ratings,TV Show,,,,"May 31, 2019",2019,TV-MA,1 Season,"Crime TV Shows, Docuseries, International TV Shows",13,3,0.8125
When They See Us,TV Show,,"Asante Blackk, Caleel Harris, Ethan Herisse, Jharrel Jerome, Marquis Rodriguez, Jovan Adepo, Chris Chalk, Justin Cunningham, Freddy Miyares, Michael Kenneth Williams, Marsha Stephanie Blake, Kylie Bunbury, Aunjanue Ellis, Vera Farmiga, Felicity Huffman, John Leguizamo, Niecy Nash",United States,"May 31, 2019",2019,TV-MA,1 Season,"Crime TV Shows, TV Dramas",13,2,0.8666666666666667
Historical Roasts,TV Show,,"Jeff Ross, Bob Saget, James Adomian, Rachel Feinstein, Jerry Minor, Ayden Mayeri, Jaleel White, Natasha Leggero, Yamaneika Saunders, John Stamos, Nikki Glaser, Seth Green, Fortune Feimster, Jon Lovitz, Mindy Rickles, Gilbert Gottfried, Sasheer Zamata, Brandon T. Jackson, Ryan Phillippe, Ken Marino, Bridget Everett, John Gemberling, Leonardo Nam, Josh Homme",United States,"May 27, 2019",2019,TV-MA,1 Season,"Stand-Up Comedy & Talk Shows, TV Comedies",16,2,0.8888888888888888
Hyper HardBoiled Gourmet Report,TV Show,,Kazutoyo Koyabu,,"May 24, 2019",2017,TV-MA,1 Season,"Docuseries, International TV Shows",28,2,0.9333333333333333
She's Gotta Have It,TV Show,,"DeWanda Wise, Cleo Anthony, Lyriq Bent, Anthony Ramos, Chyna Layne, Margot Bingham, Ilfanesh Hadera, Elvis Nolasco, De'Adre Aziza",United States,"May 24, 2019",2018,TV-MA,2 Seasons,"Romantic TV Shows, TV Comedies, TV Dramas",16,3,0.8421052631578947
WHAT / IF,TV Show,,"Renée Zellweger, Jane Levy, Blake Jenner, Keith Powers, Samantha Marie Ware, Juan Castano, Dave Annable, Saamer Usmani, Daniella Pineda, John Clarence Stewart, Louis Herthum",United States,"May 24, 2019",2019,TV-MA,1 Season,"TV Dramas, TV Thrillers",7,2,0.7777777777777778
Prince of Peoria,TV Show,,"Gavin Lewis, Theodore Barnes, Shelby Simmons, Cynthia Kaye McWilliams",United States,"May 20, 2019",2019,TV-G,2 Seasons,"Kids' TV, TV Comedies",14,2,0.875
Rosario Tijeras,TV Show,,"Bárbara de Regil, José María de Tavira, Antonio Gaona, Hernán Mendoza, Vanessa Bauche, Christian Vasquez, José Sefami, Ariel López Padilla",Mexico,"May 20, 2019",2018,TV-MA,2 Seasons,"Crime TV Shows, International TV Shows, Spanish-Language TV Shows",14,3,0.8235294117647058
1994,TV Show,Diego Enrique Osorno,,Mexico,"May 17, 2019",2019,TV-MA,1 Season,"Crime TV Shows, Docuseries, International TV Shows",4,3,0.5714285714285714
It's Bruno!,TV Show,,"Solvan ""Slick"" Naim, Rob Morgan, Shakira Barrera, Jade Eshete, Adriane Lenox, Donnell Rawlings, Eden Marryshow, Sam Eliad, Devale Ellis, J. Ray Acosta",United States,"May 17, 2019",2019,TV-MA,1 Season,TV Comedies,10,1,0.9090909090909091
White Gold,TV Show,,"Ed Westwick, James Buckley, Joe Thomas, Lauren O'Rourke, Linzey Cocker, Nigel Lindsay, Lloyd Hutchinson, Lee Ross",United Kingdom,"May 17, 2019",2019,TV-MA,2 Seasons,"British TV Shows, International TV Shows, TV Comedies",9,3,0.75
Dennis and Gnasher Unleashed,TV Show,,"Freddie Fox, Kathryn Drysdale, Rasmus Hardiker, Joanna Ruiz, Ryan Sampson, Kelly Marie Stewart",United Kingdom,"May 15, 2019",2017,TV-Y,1 Season,"British TV Shows, Kids' TV, TV Comedies",25,3,0.8928571428571429
